ID,Author,Book,Book Abbrev.,Citation,Translation,Quotes,Rate,Topics,Tags
1240,,Matthew,Matt,7:7-8,NIV,"Ask and it will be given to you; seek and you will find; knock and the door will be opened to you. For everyone who asks receives; the one who seeks finds; and to the one who knocks, the door will be opened.",2,Jobs,"Progress, Obstacles, Opportunity, Movement"
1239,Mary Baker Eddy,Message to the Mother Church,Msg 02,17:25,,"...conscious worth satisfies the hungry heart, and nothing else can.",1,Self-worth,"Confidence, Identity"
1238,Mary Baker Eddy,Science and Health,SH,15:23-24,,"The Master's injunction is, that we pray in secret and let our lives attest our sincerity.",1,Prayer,"Spirituality, Angels"
1237,Mary Baker Eddy,Science and Health,SH,272:19-25,,It is the spiritualization of thought and Christianization of daily life… it is chastity and purity… which really attest the divine origin and operation of Christian Science.,2,Spirituality,"Pure, Moral"
1236,Mary Baker Eddy,Science and Health,SH,259:1-5,,"Man is not absorbed in Deity, and man cannot lose his individuality, for he reflects eternal Life; nor is he an isolated, solitary idea, for he represents infinite Mind, the sum of all substance.",1,Loneliness,"Unity, Identity, Place, Purpose, Expression"
1235,Mary Baker Eddy,Science and Health,SH,1:11,,"Desire is prayer; and no loss can occur from trusting God with our desires, that they may be moulded and exalted before they take form in words and deeds.",1,"Jobs, Prayer","Purpose, Dream, Goal, Success, Love, Spirituality, Prayer"
1234,Mary Baker Eddy,Science and Health,SH,39:18-22,,"Now, cried the apostle, ""is the accepted time; behold, now is the day of salvation,"" — meaning, not that now men must prepare for a future-world salvation, or safety, but that now is the time in which to experience that salvation in spirit and in life.",3,Jobs,"Free, Bully, Peace, Health"
1233,Mary Baker Eddy,Miscellaneous Writings,Mis,302:32,,"I recommend that students stay within their own fields of labor, to work for the race; they are lights that can not be hid, and need only to shine from their home summits to be sought and found as healers physical and moral.",4,Jobs,"Job, Purpose, Gift"
1232,Mary Baker Eddy,Science and Health,SH,60:29-30,,Soul has infinite resources with which to bless mankind...,2,Jobs,"Supply, Career, Mission, Service, Infinity, Lack, Competition, Divorce, Drugs, Stealing, Shop-lifting, Pregnancy, Conflict"
1231,Mary Baker Eddy,Science and Health,SH,8:28,,"We should examine ourselves and learn what is the affection and purpose of the heart, for in this way only can we learn what we honestly are.",2,Identity,"Self, Identity, Rape, Infidelity, Adultery"
1230,Jesus,Matthew,Matt,6:33,MSG,"Steep your life in God-reality, God-initiative, God-provisions. Don't worry about missing out. You'll find all your everyday human concerns will be met.",1,Money,"Popular, Different, Friends, Love, Premarital Sex, Infidelity, Divorce, Getting Drunk, Smoking, Peer Pressure"
1213,Mary Baker Eddy,Science and Health,SH,451:2,,"Christian Scientists must live under the constant pressure of the apostolic command to come out from the material world and be separate. They must renounce aggression, oppression and the pride of power.  Christianity, with the crown of Love upon her brow, must be their queen of life.",2,Stress,"Money, Materialism, Manipulation, Violence"
1212,Mary Baker Eddy,Science and Health,SH,426:9-11,,"The struggle for Truth makes one strong instead of weak, resting instead of wearying one.",2,Stress,"Sports, Strength, Failure, Drugs"
1210,,Psalms,Ps,17:7-15,MSG,"I call to you, God, because I'm sure of an answer. So—answer! bend your ear! listen sharp! Paint grace-graffiti on the fences; take in your frightened children who are running from the neighborhood bullies straight to you.",2,Prayer,"Parents, Eyes, Ears, Art, Child, Tough Stuff, Bullying"
1207,,Song of Solomon,Song,2:3-4,NIV,"Like an apple tree among the trees of the forest is my beloved among the young men.  I delight to sit in his shade, and his fruit is sweet to my taste.  Let him lead me to the banquet hall, and let his banner over me be love.",2,Marriage,"Dating, Affection"
1206,,Song of Solomon,Song,1:2,NLT,"Kiss me and kiss me again, for your love is sweeter than wine.",2,Relationships,"Communication, Affection, Word, Inspiration, Dating"
1195,,Psalms,Ps,49:16,MSG,"So don't be impressed with those who get rich and pile up fame and fortune. They can't take it with them; fame and fortune all get left behind. Just when they think they've arrived and folks praise them because they've made good, They enter the family burial plot where they'll never see sunshine again.",3,Money,"Pop Culture, Wealth"
1190,Mary Baker Eddy,"Message to the Mother Church, 1902",Msg 02,17:16-19,,"Who of the world's lovers ever found her true? It is wise to be willing to wait on God, and to be wiser than serpents; to hate no man, to love one's enemies, and to square accounts with each passing hour.",2,Breakups,"Dating, Break-ups"
1189,Mary Baker Eddy,"Message to the Mother Church, 1900",Msg 00,11:13,,"Music is more than sound in unison. The deaf Beethoven besieges you with tones intricate, profound, commanding. Mozart rests you. To me his composition is the triumph of art, for he measures himself against deeper grief. I want not only quality, quantity, and variation in tone, but the unction of Love.",2,Creativity,"Love, Passion, Grief, Arts, Music"
1187,Mary Baker Eddy,Science and Health,SH,248:3-5,,Love never loses sight of loveliness. Its halo rests upon its object.,1,Friends,"Self, Looks"
1185,Mary Baker Eddy,Miscellaneous Writings,Mis,117:1,,A progressive life is the reality of Life that unfolds its immortal Principle.,1,Progress,"Decisions, Progress"
1183,Mary Baker Eddy,Christian Science vs. Pantheism,Pan,14:19-23,,"In your peaceful homes remember our brave soldiers, whether in camp or in battle. Oh, may their love of country, and their faithful service thereof, be unto them life-preservers! May the divine Love succor and protect them...",1,World Peace,"Faithful, Sacrifice, Military, Safety, World, War"
1170,,Isaiah,Isa,54:5,KJV,For thy Maker is thine husband; the Lord of hosts is his name; and thy Redeemer the Holy One of Israel; The God of the whole earth shall he be called.,2,Relationships,"Husband, Family, Earth, Tough Stuff, Divorce, Marriage, Rape, Porn"
1168,,Ecclesiastes,Eccl,4:9-10,NIV,"Two are better than one; because they have a good return for their labor. If either of them falls down, one can help the other up.",1,Friends,"Team, Help, Brotherhood"
1167,,Genesis,Gen,"33:1-3,10-11",MSG,"Jacob looked up and saw Esau coming with his four hundred men... Esau ran up and embraced him, held him tight and kissed him. And they both wept. Jacob said, ""Please. If you can find it in your heart to welcome me, accept these gifts... God has been good to me and I have more than enough."" ...and Esau accepted.",4,Forgiveness,"Friends, Siblings"
1157,,Psalms,Ps,4:4-5,MSG,"Complain if you must, but don't lash out. Keep your mouth shut, and let your heart do the talking. Build your case before God and wait for his verdict.",2,Relationships,"Anxiety, Prayer, Anger, Dating, Communication, Dreams, Divorce, Cheating"
1155,,Matthew,Matt,5:36-37,MSG,"You don't make your words true by embellishing them with religious lace. In making your speech sound more religious, it becomes less true. Just say “yes” and “no.” When you manipulate words to get your own way, you go wrong.",2,Relationships,"Light, Expression, Purpose, Job, Cheating, Dating, Communication"
1148,Mary Baker Eddy,Science and Health,SH,234:4,,"Whatever inspires with wisdom, Truth, or Love — be it song, sermon, or Science — blesses the human family with crumbs of comfort from Christ's table, feeding the hungry and giving living waters to the thirsty.",2,Spirituality,"Creativity, Inspiration, Direction, Intelligence, Guidance, Work"
1146,Mary Baker Eddy,Miscellaneous Writings,Mis,138:9,,"For students to work together is not always to cooperate, but sometimes to coelbow! Each student should seek alone the guidance of our common Father — even the divine Principle which he claims to demonstrate, — and especially should he prove his faith by works, ethically, physically, and spiritually. Remember that the first and last lesson of Christian Science is love, perfect love, and love made perfect through the cross.",4,Competition,"Unity, Cheating, Peer Pressure, Pornography"
1138,Mary Baker Eddy,Science and Health,SH,68:4-6,,"Sometime we shall learn how Spirit, the great architect, has created men and women in Science.",2,Identity,"Spiritual, Architect"
1137,Mary Baker Eddy,Science and Health,SH,576: 21-23,,"This kingdom of God ""is within you,"" — is within reach of man's consciousness here, and the spiritual idea reveals it.",2,Spirituality,"Spirituality, Afterlife"
1131,Mary Baker Eddy,Science and Health,SH,333:9-13,,"Christ expresses God's spiritual, eternal nature. The name is synonymous with Messiah, and alludes to the spirituality which is taught, illustrated, and demonstrated in the life of which Christ Jesus was the embodiment.",2,Jesus,"Spirituality, Christ"
1130,Mary Baker Eddy,Science and Health,SH,333:16-23,,"The advent of Jesus of Nazareth marked the first century of the Christian era, but the Christ is without beginning of years or end of days. Throughout all generations both before and after the Christian era, the Christ, as the spiritual idea, — the reflection of God, — has come with some measure of power and grace to all prepared to receive Christ, Truth.",3,Jesus,"Spirituality, Science, Christ"
1128,Mary Baker Eddy,Science and Health,SH,313:23-26,,"Jesus of Nazareth was the most scientific man that ever trod the globe. He plunged beneath the material surface of things, and found the spiritual cause.",1,Jesus,"Spirituality, Science"
1122,Mary Baker Eddy,Science and Health,SH,26:10-14,,"The Christ was the Spirit which Jesus implied in his own statements: ""I am the way, the truth, and the life;"" ""I and my Father are one."" This Christ, or divinity of the man Jesus, was his divine nature, the godliness which animated him.",2,Jesus,"Interfaith, Jesus Christ"
1121,Mary Baker Eddy,Science and Health,SH,26:14,,"Divine Truth, Life, and Love gave Jesus authority over sin, sickness, and death. His mission was to reveal the Science of celestial being, to prove what God is and what He does for man.",2,Jesus,"Interfaith, Jesus Christ"
1117,Mary Baker Eddy,Science and Health,SH,103:15,,"The maximum of good is the infinite God and His idea, the All-in-all. Evil is a suppositional lie.",1,Tragedy,Interfaith
1112,Mary Baker Eddy,Science and Health,SH,123:12,,"Divine Science, rising above physical theories, excludes matter, resolves things into thoughts, and replaces the objects of material sense with spiritual ideas.",4,Spirituality,"Matter, Ideas, Sense, Disease"
1110,Mary Baker Eddy,Science and Health,SH,102:12,,"The planets have no more power over man than over his Maker, since God governs the universe; but man, reflecting God's power, has dominion over all the earth and its hosts.",4,Spirituality,"Pop Culture, Astrology"
1106,Mary Baker Eddy,No and Yes,No,"34:18-19, 22-26",,"The blood of Christ speaketh better things than that of Abel....The real blood or Life of Spirit is not yet discerned. Love bruised and bleeding, yet mounting to the throne of glory in purity and peace, over the steps of uplifted humanity, — this is the deep significance of the blood of Christ.",5,Jesus,"Interfaith, Atonement"
1103,Mary Baker Eddy,Retrospection and Introspection,Ret,26:8-16,,"Our great Way-shower... demonstrated for all time and peoples the supremacy of good over evil, and the superiority of Spirit over matter. The miracles recorded in the Bible... uninspired interpreters ignorantly pronounce Christ's healing miraculous, instead of seeing therein the operation of the divine law.",5,Jesus,"Interfaith, Mary Baker Eddy"
1096,Mary Baker Eddy,"Message to the Mother Church, 1901",Msg 01,12:27-2,,"Evil is neither quality nor quantity:  it is not intelligence, a person or a principle, a man or a woman, a place or a thing, and God never made it.",2,Tragedy,Interfaith
1089,,Jeremiah,Jer,30:17,NKJV,"For I will restore health to you And heal you of your wounds,’ says the Lord",1,Health,"Health, Bones"
1084,,Hebrews,Heb,11:3,NKJV,"By faith we understand that the worlds were framed by the word of God, so that the things which are seen were not made of things which are visible.",3,Spirituality,"Spirituality, Matter"
1083,Jesus,John,John,10:24-25,KJV,"Then came the Jews round about him, and said unto him, How long dost thou make us to doubt?  If thou be the Christ, tell us plainly. Jesus answered them, I told you, and ye believed not: the works that I do in my Father's name, they bear witness of me.",2,Jesus,"Interfaith, Jesus Christ"
1079,,I John,l John,5:20,NIV,"We know also that the Son of God has come and has given us understanding, so that we may know him who is true. And we are in him who is true by being in his Son Jesus Christ. He is the true God and eternal life.",4,Spirituality,"Interfaith, Eternal Life, Truth, Jesus Christ, Eternal Life"
1078,,1 John,l John,2:24-25,MSG,"If what you heard from the beginning lives deeply in you, you will live deeply in both Son and Father. This is exactly what Christ promised: eternal life, real life!",4,Spirituality,"Spirituality, Afterlife"
1071,Mary Baker Eddy,Miscellaneous Writings,Mis,"81:26, 82:4-6",,"...divine Love hears and answers the human call for help;... Understanding this fact in Christian Science, brings the peace symbolized by a dove; and this peace floweth as a river into a shoreless eternity.",2,World Peace,"Eternity, Divine Love, Christian Science"
1070,Mary Baker Eddy,Miscellaneous Writings,Mis,307:5,,"What a glorious inheritance is given to us through the understanding of omnipresent Love! More we cannot ask:  more we do not want: more we cannot have. This sweet assurance is the “Peace, be still” to all human fears, to suffering of every sort.",2,World Peace,"Inheritance, Abundance, Supply, Peace, Suffering"
1069,Mary Baker Eddy,"The First Church of Christ, Scientist, and Miscellany",My,284:23,,"But here let me say that I am absolutely and religiously opposed to war, whereas I do believe implicitly in the full efficacy of divine Love to conciliate by arbitration all quarrels between nations and peoples.",2,World Peace,"Conflict, Conflict Resolution, Fighting, Arguments, Arbitration"
1068,Mary Baker Eddy,"The First Church of Christ, Scientist, and Miscellany",My,282:10-13,,"Through the wholesome chastisements of Love, nations are helped onward towards justice, righteousness, and peace, which are the landmarks of prosperity.",2,World Peace,"Purity, Purification, Justice, Prosperity"
1067,Mary Baker Eddy,Science and Health,SH,589:8,,"JAPHET (Noah's son).  A type of spiritual peace, flowing from the understanding that God is the divine Principle of all existence, and that man is His idea, the child of His care.",2,World Peace,"Source, Idea, Child"
1066,Mary Baker Eddy,Science and Health,SH,458:23-25,,"The Christianly scientific man reflects the divine law, thus becoming a law unto himself. He does violence to no man.",2,World Peace,"Law, Violence, Restraint"
1065,Mary Baker Eddy,Miscellaneous Writings,Mis,356:5,,"The pent-up elements of mortal mind need no terrible detonation to free them. Envy, rivalry, hate need no temporary indulgence that they be destroyed through suffering; they should be stifled from lack of air and freedom.",2,World Peace,"Fighting, Clash, Assault, Envy, Rivalry, Bullying"
1064,Mary Baker Eddy,"The First Church of Christ, Scientist, and Miscellany",My,286:3,,"For many years I have prayed daily that there be no more war, no more barbarous slaughtering of our fellow-beings; prayed that all the peoples on earth and the islands of the sea have one God, one Mind; love God supremely, and love their neighbor as themselves.",1,World Peace,"Fighting, Violence, Clash Assault, Envy, Rivalry, Bullying, Love, Neighbor"
1063,Mary Baker Eddy,,,The Mary Baker Eddy Collection,,Hatred cannot pierce peace nor penetrate the solid armor of love.,4,World Peace,"Hatred, Protection, Safety, Love"
1062,Mary Baker Eddy,,,Mary Baker Eddy Letters,,"All my work, all my efforts, all my prayers and tears are for humanity, and the spread of peace and love among mankind.",2,World Peace,"Prayer, Empathy, Mindfulness, Community, Caretaking"
1061,Mary Baker Eddy,Science and Health,SH,571:15-19,,"At all times and under all circumstances, overcome evil with good. Know thyself, and God will supply the wisdom and the occasion for a victory over evil. Clad in the panoply of Love, human hatred cannot reach you.",2,World Peace,"Protection, Safety, Good"
1060,Mary Baker Eddy,Miscellaneous Writings,Mis,268:27-28,,"From lack of moral strength empires fall. Right alone is irresistible, permanent, eternal.",1,World Peace,"Moral Strength, Attraction, Eternal, Porn"
1059,Mary Baker Eddy,Miscellaneous Writings,Mis,12:8,,"Never return evil for evil; and, above all, do not fancy that you have been wronged when you have not been.",2,World Peace,"Neighbor, Restraint, Anger, Grace"
1058,,Isaiah,Isa,33: 15-16,MSG,"The answer's simple: Live right, speak the truth, despise exploitation, refuse bribes, reject violence, avoid evil amusements. This is how you raise your standard of living! A safe and stable way to live. A nourishing, satisfying way to live.",3,World Peace,"Righteousness, Progress, Satisfaction, Success"
1057,,Acts,Acts,"2:1, 4, 6-8",NIV,"When the day of Pentecost came... All of them were filled with the Holy Spirit and began to speak in other tongues as the Spirit enabled them... a crowd came together in bewilderment... Utterly amazed, they asked: “Aren’t all these who are speaking Galileans? Then how is it that each of us hears them in our native language?",3,World Peace,"Holy Spirit, Connection, Communication, World, Government"
1056,Paul,II Corinthians,ll Cor,10:3-5,NIV,"For though we live in the world, we do not wage war as the world does. The weapons we fight with are not the weapons of the world. On the contrary, they have divine power to demolish strongholds. We demolish arguments and every pretension that sets itself up against the knowledge of God, and we take captive every thought to make it obedient to Christ.",3,World Peace,"Fighting, Obedience, Resistance, War"
1055,,Psalms,Ps,93:4,NKJV,"The LORD on high is mightier Than the noise of many waters, Than the mighty waves of the sea.",1,"World Peace, Environment","Power, Dominion, Authority, Storm, Tough Stuff, Violence"
1054,,Psalms,Ps,"85: 1, 10",KJV,"Lord, thou hast been favourable unto thy land: Mercy and truth are met together; righteousness and peace have kissed each other.",2,World Peace,"Peace, Righteousness, Blessings"
1053,,Psalms,Ps,7: 16,NLT,The trouble they make for others backfires on them.The violence they plan falls on their own heads.,2,World Peace,Punishment
1052,,Isaiah,Isa,66:18,KJV,"...I will gather all nations and tongues; and they shall come, and see my glory.",2,World Peace,"Glory, Interfaith, Salvation"
1051,,Isaiah,Isa,60:16-18,MSG,"I, God, am your Savior, your Redeemer, Champion of Jacob....  I'll install Peace to run your country, make Righteousness your boss.",2,World Peace,"Righteousness, Progress, Boss"
1050,,Isaiah,Isa,59:19,KJV,"When the enemy shall come in like a flood, the Spirit of the Lord shall lift up a standard against him.",1,World Peace,"Flood, Defence, Enemies, Spirit"
1049,,Isaiah,Isa,54:17,NKJV,"No weapon formed against you shall prosper,  And every tongue which rises against you in judgment You shall condemn. This is the heritage of the servants of the LORD, And their righteousness is from Me, Says the LORD.",2,World Peace,"Tough Stuff, Violence"
1048,,Matthew,Matt,"5:43-45,48",CEV,"You have heard people say, ""Love your neighbors and hate your enemies.""  But I tell you to love your enemies and pray for anyone who mistreats you.  Then you will be acting like your Father.... He makes the sun rise on both good and bad people....  You must always act like your Father in heaven.",2,World Peace,"World, War"
1047,,Luke,Luke,22:50-51,KJV,"And one of them smote the servant of the high priest, and cut off his right ear.  And Jesus answered and said, Suffer ye thus far. And he touched his ear, and healed him.",2,World Peace,"Tough Stuff, Violence"
1046,,Revelation,Rev,22: 1-2,NIV,"Then the angel showed me the river of the water of life, as clear as crystal, flowing from the throne of God and of the Lamb down the middle of the great street of the city. On each side of the river stood the tree of life, bearing twelve crops of fruit, yielding its fruit every month. And the leaves of the tree are for the healing of the nations.",3,World Peace,"Spirituality, Nature"
1045,Moses,Exodus,Ex,20:13,KJV,Thou shalt not kill.,1,World Peace,"World, War"
1044,,Malachi,Mal,2:10,MSG,Don't we all come from one Father? Aren't we all created by the same God? So why can't we get along?,2,World Peace,"Friends, Conflict"
1043,,John,John,16:33,ESV,"I have said these things to you, that in me you may have peace. In the world you will have tribulation. But take heart; I have overcome the world.",1,World Peace,"Tough Stuff, Tragedy"
1042,,John,John,14:27,NIV,Peace I leave with you; my peace I give you. I do not give to you as the world gives. Do not let your hearts be troubled and do not be afraid.,1,World Peace,"World, Peace"
1041,,Psalms,Ps,122:7-8,NKJV,Peace be within your walls....peace be within you.,1,World Peace,"World, Peace"
1040,,Isaiah,Isa,55:12,KJV,"For ye shall go out with joy, and be led forth with peace: the mountains and the hills shall break forth before you into singing, and all the trees of the field shall clap their hands.",1,World Peace,"School, College, Stress, Happiness, Celebrate"
1039,,ll Samuel,ll Sam,22:2-3,NLT,"My God is my rock, in whom I find protection. He is my shield, the power that saves me, and my place of safety. He is my refuge, my savior, the one who saves me from violence.",2,World Peace,"Feelings, Violence"
1038,Paul,I Corinthians,l Cor,14:33,KJV,"God is not the author of confusion, but of peace",1,World Peace,"Clarity, Confusion, Peace, Stress, Mental Health, Health"
1037,,Matthew,Matt,5:9,NLT,"God blesses those who work for peace, for they will be called the children of God.",1,World Peace,"Child, Work"
1036,,Ephesians,Eph,4:32,NLT,"...be kind to each other, tenderhearted, forgiving one another, just as God through Christ has forgiven you.",1,World Peace,"Tough Stuff, Violence"
1035,,Jeremiah,Jer,29:11,KJV,"For I know the thoughts that I think toward you, saith the Lord, thoughts of peace, and not of evil, to give you an expected end.",2,World Peace,"Health, Mental Health"
1034,Jesus,Matthew,Matt,26:52,NIV,"Put your sword back in its place,” Jesus said to him, “for all who draw the sword will die by the sword.”",2,World Peace,"Feelings, Violence"
1033,,Proverbs,Prov,16:7,MSG,"When God approves of your life, even your enemies will end up shaking your hand.",1,World Peace,"World, Peace"
1032,,Psalms,Ps,133:1,NIV,How good and pleasant it is when God’s people live together in unity!,1,World Peace,"Sports, Teamwork"
1031,Mary Baker Eddy,Science and Health,SH,291:9-25,,"Mortals need not fancy that belief in the experience of death will awaken them to glorified being....As death findeth mortal man, so shall he be after death...",4,Tragedy,"World, Terrorism"
1030,Mary Baker Eddy,Science and Health,SH,96:31,,"...wicked minds will endeavor to find means by which to accomplish more evil; but those who discern Christian Science will hold crime in check. They will aid in the ejection of error. They will maintain law and order, and cheerfully await the certainty of ultimate perfection.",2,Tragedy,"World, Terrorism"
1029,Mary Baker Eddy,Science and Health,SH,96:15,,"The breaking up of material beliefs may seem to be famine and pestilence, want and woe, sin, sickness, and death, which assume new phases until their nothingness appears. These disturbances will continue until the end of error, when all discord will be swallowed up in spiritual Truth.",2,Tragedy,"Tough Stuff, Tragedy"
1028,Mary Baker Eddy,Science and Health,SH,574:27-30,,"The very circumstance, which your suffering sense deems wrathful and afflictive, Love can make an angel entertained unawares.",1,Tragedy,"Tough Stuff, Tragedy"
1027,Mary Baker Eddy,Science and Health,SH,473:8-10,,"God is everywhere, and nothing apart from Him is present or has power.",1,Tragedy,"World, Terrorism"
1026,Mary Baker Eddy,Science and Health,SH,424:5-9,,"Accidents are unknown to God, or immortal Mind, and we must leave the mortal basis of belief and unite with the one Mind, in order to change the notion of chance to the proper sense of God's unerring direction and thus bring out harmony.",2,Tragedy,"Tough Stuff, Accidents"
1025,Mary Baker Eddy,Miscellaneous Writings,Mis,10:10-13,,"Their God will not let them be lost; and if they fall they shall rise again, stronger than before the stumble. The good cannot lose their God, their help in times of trouble.",2,Tragedy,"Sports, Losing"
1024,Mary Baker Eddy,Science and Health,SH,66:10-11,,Trials are proofs of God’s care.,1,Tragedy,"Proof, Demonstration"
1023,Mary Baker Eddy,Science and Health,SH,424:10-11,,"Under divine Providence there can be no accidents, since there is no room for imperfection in perfection.",2,Tragedy,"Tough Stuff, Accidents"
1022,Mary Baker Eddy,"The First Church of Christ, Scientist, and Miscellany",My,149:31-2,,"Remember, thou canst be brought into no condition, be it ever so severe, where Love has not been before thee and where its tender lesson is not awaiting thee.",1,Tragedy,"World, Terrorism"
