ID,Author,Book,Book Abbrev.,Citation,Translation,Quotes,Rate,Topics,Tags
802,Mary Baker Eddy,Science and Health,SH,4:5,,"To keep the commandments of our Master and follow his example, is our proper debt to him and the only worthy evidence of our gratitude for all that he has done. Outward worship is not of itself sufficient to express loyal and heartfelt gratitude, since he has said: ""If ye love me, keep my commandments.""",2,Purpose,"Money, Gratitude"
801,Mary Baker Eddy,"Message to the Mother Church, 1902",Msg 02,4:28,,Our thoughts of the Bible utter our lives.,1,Purpose,"Interfaith, Bible"
800,Mary Baker Eddy,Science and Health,SH,326:16-21,,"The purpose and motive to live aright can be gained now. This point won, you have started as you should.  You have begun at the numeration-table of Christian Science, and nothing but wrong intention can hinder your advancement. Working and praying with true motives, your Father will open the way.",3,Purpose,"Decisions, Motives"
799,Mary Baker Eddy,Science and Health,SH,248:26,,"We must form perfect models in thought and look at them continually, or we shall never carve them out in grand and noble lives. Let unselfishness, goodness, mercy, justice, health, holiness, love — the kingdom of heaven — reign within us, and sin, disease, and death will diminish until they finally disappear.",2,Purpose,"Decisions, Motives"
798,Mary Baker Eddy,Miscellaneous Writings,Mis,230:8-12,,"Three ways of wasting time, one of which is contemptible, are gossiping mischief, making lingering calls, and mere motion when at work, thinking of nothing or planning for some amusement, — travel of limb more than mind.",3,Purpose,"Friends, Gossip"
797,Mary Baker Eddy,"The First Church of Christ, Scientist, and Miscellany",My,160: 5-8,,"To live so as to keep human consciousness in constant relation with the divine, the spiritual, and the eternal, is to individualize infinite power; and this is Christian Science.",2,Purpose,"Feelings, Moody"
796,Mary Baker Eddy,Science and Health,SH,597:16,,"WILDERNESS. Loneliness; doubt; darkness. Spontaneity of thought and idea; the vestibule in which a material sense of things disappears, and spiritual sense unfolds the great facts of existence.",2,Purpose,"Pregnancy, Disease, Anger, Self-hate, Rape, Pornography"
794,Mary Baker Eddy,Science and Health,SH,22:11-12,,"""Work out your own salvation,"" is the demand of Life and Love, for to this end God worketh with you.",1,Purpose,"Interfaith, Salvation"
793,Mary Baker Eddy,"Message to the Mother Church, 1902",Msg 02,2:4-7,,"To live and let live, without clamor for distinction or recognition; to wait on divine Love; to write truth first on the tablet of one's own heart, — this is the sanity and perfection of living, and my human ideal.",1,Purpose,"Interfaith, Unity"
792,Mary Baker Eddy,Miscellaneous Writings,Mis,154:28-29,,Let your light reflect Light.,3,Purpose,"Light, Reflect, Purpose"
791,,Luke,Luke,11:33,NIV,"No one lights a lamp and puts it in a place where it will be hidden, or under a bowl. Instead they put it on its stand, so that those who come in may see the light.",3,Purpose,"Light, Arts, Expression"
790,Paul,Romans,Rom,8:28,KJV,"And we know that all things work together for good to them that love God, to them who are the called according to his purpose.",2,Purpose,"Sports, Teamwork"
789,Paul,Philippians,Phil,4:8,NLT,"Fix your thoughts on what is true, and honorable, and right, and pure, and lovely, and admirable. Think about things that are excellent and worthy of praise.",3,Purpose,"Pop Culture, Media"
788,Jesus,Matthew,Matt,4:18-19,NKJV,"And Jesus, walking by the Sea of Galilee, saw two brothers, Simon called Peter, and Andrew his brother, casting a net into the sea; for they were fishermen. Then He said to them, “Follow Me, and I will make you fishers of men.”",3,Purpose,"Self, Purpose"
786,Mary Baker Eddy,Science and Health,SH,466:26,,"The Science of Christianity comes with fan in hand to separate the chaff from the wheat. Science will declare God aright, and Christianity will demonstrate this declaration and its divine Principle, making mankind better physically, morally, and spiritually.",3,Progress,"Truth, Christian, Morality, Progress, Peer Pressure, Cheating, Porn"
785,Mary Baker Eddy,Science and Health,SH,426:9-10,,"When the destination is desirable, expectation speeds our progress.",2,Progress,"Health, Love, Success, Joy"
784,Mary Baker Eddy,Science and Health,SH,239:16,,"To ascertain our progress, we must learn where our affections are placed and whom we acknowledge and obey as God.",2,Progress,"Frustration, Future, Obedience"
783,Mary Baker Eddy,Science and Health,SH,454:18-21,,"Love inspires, illumines, designates, and leads the way.  Right motives give pinions to thought, and strength and freedom to speech and action.",1,Progress,"Progress, Purpose, Motives, Inspiration"
782,Mary Baker Eddy,Science and Health,SH,291:9-25,,"Mortals need not fancy that belief in the experience of death will awaken them to glorified being....As death findeth mortal man, so shall he be after death, until probation and growth shall effect the needed change.",2,Progress,"After Death, Probation, Growth"
781,Mary Baker Eddy,Science and Health,SH,253:32-6,,"The divine demand, ""Be ye therefore perfect,"" is scientific, and the human footsteps leading to perfection are indispensable. Individuals are consistent who, watching and praying, can ""run, and not be weary; . . . walk, and not faint,"" who gain good rapidly and hold their position, or attain slowly and yield not to discouragement.",1,Progress,"Peace, Health, Fear, Healing"
780,Mary Baker Eddy,Science and Health,SH,233:6,,"...progress is the law of God, whose law demands of us only what we can certainly fulfil.",1,Progress,"Progress, Path, Energy"
779,Mary Baker Eddy,Science and Health,SH,224:8,,"There should be painless progress, attended by life and peace instead of discord and death.",1,Progress,"Progress, Peace"
778,Mary Baker Eddy,People’s Idea of God,Peo,1:2,,Every step of progress is a step more spiritual.,1,Progress,"Progress, Spirituality, Faith, Frustration, Spirituality, Path"
777,Paul,Romans,Rom,8:28,NKJV,"And we know that all things work together for good to those who love God, to those who are the called according to His purpose.",2,Progress,"School, College"
776,,Isaiah,Isa,2:3,MSG,"Come, let's climb God's Mountain, go to the House of the God of Jacob. He'll show us the way he works so we can live the way we're made.",3,Progress,"Decisions, Progress"
775,Mary Baker Eddy,Science and Health,SH,298:28-29,,"Angels are pure thoughts from God, winged with Truth and Love...",2,Prayer,"Spirituality, Angels"
774,Mary Baker Eddy,Science and Health,SH,298:25-30,,"Angels are not etherealized human beings, evolving animal qualities in their wings; but they are celestial visitants, flying on spiritual, not material, pinions. Angels are pure thoughts from God, winged with Truth and Love, no matter what their individualism may be.",4,Prayer,"Spirituality, Angels"
773,Mary Baker Eddy,Science and Health,SH,495:16-20,,"Let neither fear nor doubt overshadow your clear sense and calm trust, that the recognition of life harmonious — as Life eternally is — can destroy any painful sense of, or belief in, that which Life is not.",2,Prayer,"Spirituality, Doubt"
772,Mary Baker Eddy,Science and Health,SH,299:7-15,,"My angels are exalted thoughts... With white fingers they point upward to a new and glorified trust,  to higher ideals of life and its joys. Angels are God's representatives. These upward-soaring beings never lead towards self, sin, or materiality, but guide to the divine Principle of all good, whither every real individuality, image, or likeness of God, gathers.",3,Prayer,"Spirituality, Angels"
771,Mary Baker Eddy,Science and Health,SH,23:17,,"Faith, advanced to spiritual understanding, is the evidence gained from Spirit, which rebukes sin of every kind and establishes the claims of God.",2,Prayer,"Faith, Spirituality"
770,Mary Baker Eddy,Science and Health,SH,15:26-27,,"Self-forgetfulness, purity, and affection are constant prayers.",1,Prayer,"Spirituality, Prayer"
769,Mary Baker Eddy,Science and Health,SH,581:4,,"ANGELS.  God's thoughts passing to man; spiritual intuitions, pure and perfect; the inspiration of goodness, purity, and immortality, counteracting all evil, sensuality, and mortality.",2,Prayer,"Spirituality, Angels"
768,Mary Baker Eddy,No and Yes,No,39:17-18,,"True prayer is not asking God for love; it is learning to love, and to include all mankind in one affection.",1,Prayer,"Spirituality, Faith"
767,Mary Baker Eddy,Science and Health,SH,298:13-15,,"Spiritual sense, contradicting the material senses, involves intuition, hope, faith, understanding, fruition, reality.",2,Prayer,"Spirituality, Faith"
766,Mary Baker Eddy,Science and Health,SH,2:15-16,,"Prayer cannot change the Science of being, but it tends to bring us into harmony with it.",2,Prayer,"Spirituality, Prayer"
765,Mary Baker Eddy,Science and Health,SH,367:10,,"This is what is meant by seeking Truth, Christ, not ""for the loaves and fishes,"" nor, like the Pharisee, with the arrogance of rank and display of scholarship, but like Mary Magdalene, from the summit of devout consecration, with the oil of gladness and the perfume of gratitude, with tears of repentance and with those hairs all numbered by the Father.",3,Prayer,"Money, Gratitude"
764,Mary Baker Eddy,Science and Health,SH,4:3-5,,"What we most need is the prayer of fervent desire for growth in grace, expressed in patience, meekness, love, and good deeds.",1,Prayer,"Money, Gratitude"
763,Mary Baker Eddy,Science and Health,SH,323:28-32,,"The effects of Christian Science are not so much seen as felt. It is the ""still, small voice"" of Truth uttering itself. We are either turning away from this utterance, or we are listening to it and going up higher.",4,Prayer,"Decisions, Listening"
762,Mary Baker Eddy,Pulpit and Press,Pul,22:3,,"All Christian churches have one bond of unity, one nucleus or point of convergence, one prayer, — the Lord's Prayer. It is matter for rejoicing that we unite in love, and in this sacred petition with every praying assembly on earth, — ""Thy kingdom come. Thy will be done in earth, as it is in heaven.""",1,Interfaith,"Interfaith, Prayer"
761,Mary Baker Eddy,Science and Health,SH,2:23,,"God is Love. Can we ask Him to be more? God is intelligence. Can we inform the infinite Mind of any thing He does not already comprehend? Do we expect to change perfection? Shall we plead for more at the open fount, which is pouring forth more than we accept? The unspoken desire does bring us nearer the source of all existence and blessedness.",2,Prayer,"Interfaith, Prayer"
760,Mary Baker Eddy,Science and Health,SH,15:20-22,,"We must ""pray without ceasing."" Such prayer is answered, in so far as we put our desires into practice.",1,Prayer,"Decisions, Listening"
759,Mary Baker Eddy,Science and Health,SH,14:31,,"""When thou prayest, enter into thy closet, and, when thou hast shut thy door, pray to thy Father which is in secret; and thy Father, which seeth in secret, shall reward thee openly.""",1,Prayer,"Decisions, Listening"
758,Mary Baker Eddy,No and Yes,No,39:18-24,,"Prayer is the utilization of the love wherewith He loves us. Prayer begets an awakened desire to be and do good. It makes new and scientific discoveries of God, of His goodness and power. It shows us more clearly than we saw before, what we already have and are; and most of all, it shows us what God is.",2,Prayer,"Interfaith, Prayer"
756,Mary Baker Eddy,Science and Health,SH,15:9,,"To enter into the heart of prayer, the door of the erring senses must be closed. Lips must be mute and materialism silent, that man may have audience with Spirit, the divine Principle, Love, which destroys all error.",2,Prayer,"Decisions, Listening"
755,Mary Baker Eddy,Science and Health,SH,149:28-29,,Whatever guides thought spiritually benefits mind and body.,1,Prayer,"Health, Healing"
753,Mary Baker Eddy,Science and Health,SH,261:4,,"Hold thought steadfastly to the enduring, the good, and the true, and you will bring these into your experience proportionably to their occupancy of your thoughts.",1,Prayer,"Sports, Training"
752,Mary Baker Eddy,Science and Health,SH,15:14-20,,"...to pray aright, we must enter into the closet and shut the door… close the lips and silence the material senses. In the quiet sanctuary of earnest longings, we must deny sin and plead God's allness…. resolve to take up the cross, and go forth with honest hearts to work and watch for wisdom, Truth, and Love.",2,Prayer,"Decisions, Listening"
751,Jesus,Matthew,Matt,21:20-22,NIV,"“How did the fig tree wither so quickly?”…Jesus replied, “…if you have faith and do not doubt, not only can you do what was done to the fig tree, but also you can say to this mountain, ‘Go, throw yourself into the sea,’ and it will be done. If you believe, you will receive whatever you ask for in prayer.”",1,Prayer,"Spirituality, Faith"
750,,Acts,Acts,6:4,KJV,But we will give ourselves continually to prayer and to the ministry of the word.,3,Prayer,"Interfaith, Prayer, Faith, Mission"
749,,Matthew,Matt,6:6,MSG,"Here's what I want you to do: Find a quiet, secluded place so you won't be tempted to role-play before God. Just be there as simply and honestly as you can manage. The focus will shift from you to God, and you will begin to sense his grace.",1,Prayer,"Spirituality, Faith"
748,,II Chronicles,ll Chron,6:40,MSG,"And now, dear God, be alert and attentive to prayer, all prayer, offered in this place.",2,Prayer,"Prayer, Interfaith"
747,,Psalms,Ps,5:3,KJV,"My voice shalt thou hear in the morning, O Lord; in the morning will I direct my prayer unto thee, and will look up.",1,Prayer,"Interfaith, Prayer"
746,Paul,Philippians,Phil,4:4-7,KJV,"Rejoice in the Lord always... Rejoice. Let your moderation be known unto all men.  The Lord is at hand. Be careful for nothing; but in every thing by prayer and supplication with thanksgiving let your requests be made known unto God. And the peace of God, which passeth all understanding, shall keep your hearts and minds through Christ Jesus.",3,Prayer,"Money, Gratitude"
745,Jesus,Matthew,Matt,21:21-22,MSG,"""Yes—and if you embrace this kingdom life and don't doubt God, you'll not only do minor feats like I did... but also triumph over huge obstacles. This mountain, for instance, you'll tell, 'Go jump in the lake,' and it will jump. Absolutely everything... gets included as you lay hold of God.""",4,Prayer,"Feelings, Anger"
744,,Luke,Luke,17:5-6,NLT,"The apostles said to the Lord, “Show us how to increase our faith.” The Lord answered, “If you had faith even as small as a mustard seed, you could say to this mulberry tree, ‘May you be uprooted and thrown into the sea,’ and it would obey you!",4,Prayer,"Spirituality, Faith"
743,Jesus,Matthew,Matt,17: 20-21,NKJV,"So Jesus said to them, “... if you have faith as a mustard seed, you will say to this mountain, ‘Move from here to there,’ and it will move; and nothing will be impossible for you.”",2,Prayer,"Interfaith, Prayer"
742,,Psalms,Ps,17: 1-4,MSG,"Listen while I build my case, God, the most honest prayer you'll ever hear.  Show the world I'm innocent—in your heart you know I am. Go ahead, examine me from inside out, surprise me in the middle of the night... I'm not trying to get my way in the world's way. I'm trying to get your way, your Word's way.",2,Prayer,"Feelings, Anger"
741,,Psalms,Ps,147:7-8,KJV,"Sing unto the Lord with thanksgiving; sing praise upon the harp unto our God: Who covereth the heaven with clouds, who prepareth rain for the earth, who maketh grass to grow upon the mountains.",3,Prayer,"Money, Gratitude"
740,,John,John,14:14,KJV,"If ye shall ask any thing in my name, I will do it.",1,Prayer,"Health, Healing"
739,,Hebrews,Heb,11:1,KJV,"Now faith is the substance of things hoped for, the evidence of things not seen.",2,Prayer,"Spirituality, Faith"
738,Paul,I Thessalonians,l Thess,5:14-16,NLT,Dear brothers and sisters...Be patient with everyone....always try to do good to each other and to all people.... Never stop praying.,2,Prayer,"Interfaith, Prayer, Patience, Persistence, Peace"
737,,I Timothy,l Tim,2:8,NCV,"So, I want the men everywhere to pray, lifting up their hands in a holy manner, without anger and arguments.",3,Prayer,"Feelings, Anger"
735,,Matthew,Matt,6:5-8,NLT,"...when you pray, go away by yourself, shut the door behind you, and pray to your Father in private. Then your Father, who sees everything, will reward you. “When you pray, don’t babble on and on as people of other religions do... Don’t be like them, for your Father knows exactly what you need even before you ask him!  (61 WN)",2,Prayer,"Interfaith, Prayer"
734,,Proverbs,Prov,3:5-7,MSG,"Trust God from the bottom of your heart; don't try to figure out everything on your own. Listen for God's voice in everything you do, everywhere you go; he's the one who will keep you on track. Don't assume that you know it all.",1,Prayer,"Spirituality, Faith"
733,,Psalms,Ps,"25: 16-17, 21",NLT,"Turn to me and have mercy, for I am alone and in deep distress. My problems go from bad to worse. Oh, save me from them all!  May integrity and honesty protect me, for I put my hope in you.",2,Prayer,"Feelings, Anger"
732,,I Corinthians,l Cor,13:7,NLT,"Love never gives up, never loses faith, is always hopeful, and endures through every circumstance.",4,Love,"Spirituality, Faith"
731,Mary Baker Eddy,"The First Church of Christ, Scientist, and Miscellany",My,232:6,,"The right way wins the right of way, even the way of Truth and Love whereby all our debts are paid, mankind blessed, and God glorified.",2,Money,"Freedom, Love"
730,Mary Baker Eddy,Science and Health,SH,195:28-32,,Literary commercialism is lowering the intellectual standard to accommodate the purse and to meet a frivolous demand for amusement instead of for improvement.  Incorrect views lower the standard of truth.,4,Money,"Health, Mind, Brain"
729,Mary Baker Eddy,"Message to the Mother Church, 1901",Msg 01,28:19-20,,….I love Christ more than all the world....,2,Money,"Pop Culture, Clothes"
728,Mary Baker Eddy,"The First Church of Christ, Scientist, and Miscellany",My,165:26-28,,He who is afraid of being too generous has lost the power of being magnanimous. The best man or woman is the most unselfed.,2,Money,"Self, Womanhood, Manhood"
726,Mary Baker Eddy,Science and Health,SH,507:3-6,,"Spirit duly feeds and clothes every object, as it appears in the line of spiritual creation, thus tenderly expressing the fatherhood and motherhood of God.",2,Money,"Giving, Clothes"
725,Mary Baker Eddy,Science and Health,SH,79:31-32,,"Giving does not impoverish us in the service of our Maker, neither does withholding enrich us.",1,Money,"World, Poverty"
724,Mary Baker Eddy,Science and Health,SH,518:15-19,,"The rich in spirit help the poor in one grand brotherhood, all having the same Principle, or Father; and blessed is that man who seeth his brother's need and supplieth it, seeking his own in another's good.",1,Money,"World, Poverty"
723,Mary Baker Eddy,Science and Health,SH,494:10,,"Divine Love always has met and always will meet every human need. It is not well to imagine that Jesus demonstrated the divine power to heal only for a select number or for a limited period of time, since to all mankind and in every hour, divine Love supplies all good.",1,Money,"World, Poverty"
722,Mary Baker Eddy,Miscellaneous Writings,Mis,307:1-5,,"God gives you His spiritual ideas, and in turn, they give you daily supplies.  Never ask for tomorrow:  it is enough that divine Love is an ever-present help; and if you wait, never doubting, you will have all you need every moment.",1,Money,"Money, Wealth"
721,Mary Baker Eddy,Science and Health,SH,3:22-24,,"Are we really grateful for the good already received? Then we shall avail ourselves of the blessings we have, and thus be fitted to receive more.",2,Money,"Money, Gratitude"
720,Mary Baker Eddy,Science and Health,SH,206:15,,"In the scientific relation of God to man, we find that whatever blesses one blesses all, as Jesus showed with the loaves and the fishes, — Spirit, not matter, being the source of supply.",2,Money,"World, Poverty"
719,Mary Baker Eddy,Science and Health,SH,13:15,,"...God knows our need before we tell Him or our fellow-beings about it. If we cherish the desire honestly and silently and humbly, God will bless it, and we shall incur less risk of overwhelming our real wishes with a torrent of words.",1,Money,"Money, Needs"
718,Paul,Romans,Rom,11:33,NLT,"Oh, how great are God’s riches and wisdom and knowledge!",1,Money,"Money, Wealth"
717,Paul,II Corinthians,ll Cor,8:13-14,NKJV,"For I do not mean that others should be eased and you burdened; but by an equality, that now at this time your abundance may supply their lack, that their abundance also may supply your lack—that there may be equality.",2,Money,"Poverty, Money, Needs, Supply, Church, Charity"
716,,II Kings,ll Kings,4:2-6,KJV,"And Elisha said... Go, borrow thee vessels abroad of all thy neighbours... borrow not a few... and shalt pour out into all those vessels, and thou shalt set aside that which is full... And it came to pass, when the vessels were full... her son... said unto her, There is not a vessel more.  And the oil stayed.",3,Money,"Giving, Money, Debts"
715,,Matthew,Matt,6:25-28,NIV,"…do not worry about your life, what you will eat or drink; or about your body, what you will wear. Is not life more than food, and the body more than clothes?  Look at the birds of the air; they do not sow or reap… and yet your heavenly Father feeds them. Are you not much more valuable than they?",2,Money,"Poverty, Money, Needs, Supply"
714,,Proverbs,Prov,22:2,KJV,The rich and the poor meet together; the Lord is the maker of them all.,2,Money,"World, Culture"
713,,Psalms,Ps,145:16,NIV,You open your hand and satisfy the desires of every living thing.,1,Money,Pop Culture
712,,Matthew,Matt,7:9-11,NIV,"Which of you, if your son asks for bread, will give him a stone? Or if he asks for a fish, will give him a snake?...how much more will your Father in heaven give good gifts to those who ask him!",2,Money,"Poverty, Food, Support, Responsive"
711,,Matthew,Matt,6:33,NLT,"Seek the kingdom of God above all else, and live righteously, and he will give you everything you need.",1,Money,"Money, Wealth"
710,,Matthew,Matt,6:28-29,NLT,"Why worry about your clothing?  Look at the lilies of the field and how they grow.  They don’t work or make their clothing, yet Solomon and all his glory was not dressed as beautifully as they are.",4,Money,"Pop Culture, Clothes"
709,,Matthew,Matt,6:24,NIV,"“No one can serve two masters. Either you will hate the one and love the other, or you will be devoted to the one and despise the other. You cannot serve both God and money.",2,Money,"Poverty, Pop Culture, Wealth"
708,,Matthew,Matt,6: 19-20,NIV,"Do not store up for yourselves treasures on earth, where moths and vermin destroy, and where thieves break in and steal.  But store up for yourselves treasures in heaven, where moths and vermin do not destroy, and where thieves do not break in and steal.",2,Money,"Poverty, Money, Wealth"
707,,Isaiah,Isa,35:6-7,KJV,"...in the wilderness shall waters break out, and streams in the desert. And the parched ground shall become a pool, and the thirsty land springs of water:",2,Money,"Giving, Supply, Abundance, Self-hate"
706,,Hebrews,Heb,13:5,NLT,"Don’t love money; be satisfied with what you have. For God has said, “I will never fail you. I will never abandon you.”",1,Money,"Moeny, Materialism"
705,,Luke,Luke,6:38,NLT,"Give, and you will receive. Your gift will return to you in full—pressed down, shaken together to make room for more, running over, and poured into your lap. The amount you give will determine the amount you get back.",2,Money,"Money, Needs, Supply, Want, Charity"
704,Paul,II Corinthians,ll Cor,9:8,NLT,And God will generously provide all you need. Then you will always have everything you need and plenty left over to share with others.,1,Money,"Money, Needs, Supply, Want, Charity"
703,,1 John,l John,"2:15, 17",MSG,Don't love the world's ways…. Love of the world squeezes out love for the Father. The world and all its wanting… is on the way out—but whoever does what God wants is set for eternity.,1,Money,"Pop Culture, Wealth"
702,Paul,Romans,Rom,2:10-11,NIV,"...glory, honor and peace for everyone who does good... For God does not show favoritism.",3,Manhood & Womanhood,"Disease, Cheating, Peer Pressure, Anger, Self-hate"
701,Mary Baker Eddy,Science and Health,SH,517:8-10,,"The ideal man corresponds to creation, to intelligence, and to Truth.  The ideal woman corresponds to Life and to Love.",1,Manhood & Womanhood,"Self, Womanhood, Manhood"
700,Mary Baker Eddy,Science and Health,SH,59: 7-8,,Mutual compromise will often maintain a compact which might otherwise become unbearable.,2,Manhood & Womanhood,"Dating, Marriage"
699,Mary Baker Eddy,Miscellaneous Writings,Mis,52:15:00,,"[Marriage] To be normal, it must be a union of the affections that tends to lift mortals higher.",2,Marriage,"Dating, Marriage"
698,Mary Baker Eddy,Science and Health,SH,57:10-11,,"Both sexes should be loving, pure, tender, and strong.",1,Manhood & Womanhood,"Dating, Grace"
697,Mary Baker Eddy,Miscellaneous Writings,Mis,262:10,,"When the heart speaks, however simple the words, its language is always acceptable to those who have hearts.",4,Manhood & Womanhood,"Cheating, Peer Pressure, Dating, Communication"
696,Mary Baker Eddy,Science and Health,SH,94:1,,"Jesus taught but one God, one Spirit, who makes man in the image and likeness of Himself, — of Spirit, not of matter.",3,Manhood & Womanhood,"Spirituality, Matter"
