ID,Author,Book,Book Abbrev.,Citation,Translation,Quotes,Rate,Topics,Tags
477,Mary Baker Eddy,Science and Health,SH,218:7,,The consciousness of Truth rests us more than hours of repose in unconsciousness.,4,Health,"Rest, Peace, Think, Health, Sleep"
476,Mary Baker Eddy,Science and Health,SH,208:29-31,,"You embrace your body in your thought, and you should delineate upon it thoughts of health, not of sickness.",1,Health,"Self, Image, Body Image, Identity"
475,Mary Baker Eddy,Miscellaneous Writings,Mis,193:27,,"""He that believeth on me, the works that I do shall he do,"" is a radical and unmistakable declaration of the right and power of Christianity to heal; for this is Christlike, and includes the understanding of man's capabilities and spiritual power.",1,Health,"Belief, Faith, Mission, Model, Interfaith, Discipleship"
474,Mary Baker Eddy,Science and Health,SH,162:4,,"Christian Science brings to the body the sunlight of Truth, which invigorates and purifies.",2,Health,"Purity, Energy, Refresh"
473,Mary Baker Eddy,Science and Health,SH,14:12-15,,"Become conscious for a single moment that Life and intelligence are purely spiritual, — neither in nor of matter, — and the body will then utter no complaints.",1,Health,"Consciousness, Blessings, Faith, Growth, Purpose"
472,,Ecclesiastes,Eccl,3:14,CEV,"Everything God has done will last forever; nothing he does can ever be changed. God has done all this, so that we will worship him.",4,Health,"Eternity, Perfection, Change, Praise, Worship"
471,Jesus,Matthew,Matt,9:22,NIV,"Jesus turned and saw her. “Take heart, daughter,” he said, “your faith has healed you.” And the woman was healed at that moment.",4,Health,"Redemption, Sin, Moral, Immoral, Shameful, Health, Healing"
470,,Matthew,Matt,9:2,NIV,"Some men brought to him a paralyzed man, lying on a mat. When Jesus saw their faith, he said to the man,“Take heart, son; your sins are forgiven.”",4,Health,"Forgive, Redemption, Sin, Interfaith, Health"
469,,Luke,Luke,"9:1-2,6",NLT,"One day Jesus called together his twelve disciples and gave them power and authority to cast out all demons and to heal all diseases.  Then he sent them out to tell everyone about the Kingdom of God and to heal the sick.   So they began their circuit of the villages, preaching the Good News and healing the sick.",2,Health,"Mission, Goal, Power, Preach, Faith, Interfaith, Health"
468,,Deuteronomy,Deut,7:15,NIV,The Lord will keep you free from every disease.,1,Health,"Healing, Protection, Immunity, Medicine"
467,,John,John,6:27,MSG,"Don't waste your energy striving for perishable food like that. Work for the food that sticks with you, food that nourishes your lasting life, food the Son of Man provides. He and what he does are guaranteed by God the Father to last.",4,Health,"Food, Weight, Appetite, Energy, Fasting, Health"
466,Jesus,Mark,Mark,5:30,CEV,"At that moment Jesus felt power go out from him. He turned to the crowd and asked, ""Who touched my clothes?""",4,Health,"Clothes, Sense, Being, Divinity, Humanity, Arts, Sensitivity"
465,Jesus,John,John,4:34,NLT,"Then Jesus explained: “My nourishment comes from doing the will of God, who sent me, and from finishing his work.”",3,Health,"Motives, Inspiration, Work, Goal, Mission, Health, Diet"
464,,Psalms,Ps,30:2,NCV,"Lord, my God, I prayed to you, and you healed me.",1,Health,"Prayer, Courage, Faith, Healing, Petition, Signs, Healing"
463,,Proverbs,Prov,17:22,NLT,"A cheerful heart is good medicine, but a broken spirit saps a person’s strength.",1,Health,"Medicine, Drugs, Grief, Spirituality, Happy, Heath, Healing"
462,Jesus,Mark,Mark,"16:15,17-18",NKJV,"“Go into all the world and preach the gospel to every creature. And these signs will follow those who believe: In My name they will cast out demons; they will speak with new tongues; they will take up serpents; and if they drink anything deadly, it will by no means hurt them; they will lay hands on the sick, and they will recover.”",2,Health,"Preach, Jesus Christ, Proclaim, Gospel, Good Tidings, Interfaith, Health"
461,,Matthew,Matt,15:30,NIV,"Great crowds came to him, bringing the lame, the blind, the crippled, the mute and many others, and laid them at his feet; and he healed them.",2,Health,"Symptoms, Pharmacy, Injured, Medicine, Interfaith, Health"
460,,Matthew,Matt,14:14,NIV,"When Jesus landed and saw a large crowd, he had compassion on them and healed their sick.",2,Health,"Vision, Crowd Mentality, Love, Miracle, Regeneration, Health, Healing"
459,,John,John,14:12,KJV,"Verily, verily, I say unto you, He that believeth on me, the works that I do shall he do also; and greater works than these shall he do; because I go unto my Father.",2,Health,"Reflection, Job, Freedom, Hope, Motives, Interfaith, Discipleship"
458,,Psalms,Ps,116:7,NKJV,"Return unto your rest, O my soul; for the Lord has dealt bountifully with you.",4,Health,"Rest, Peace, Salvation, Gratitude, Sleep, Health"
457,,Psalms,Ps,"107:15, 20",NIV,Let them give thanks to the Lord for his unfailing love and his wonderful deeds for mankind... He sent out his word and healed them.,2,Health,"Gratitude, Praise, Success, Thought, Interfaith, Health, Interfaith"
456,,II Kings,ll Kings,"5: 1,10,14",NIV,"Naaman... was a great man...  but he had leprosy.... Elisha sent a messenger to say to him, “Go, wash yourself seven times in the Jordan, and your flesh will be restored...”  So he went down and dipped himself in the Jordan seven times... and his flesh was restored and became clean like that of a young boy.",4,Health,"Skin, Flesh, Clean, Cleanse, Contagion, Interfaith, Health"
455,,Acts,Acts,28:8-9,NLT,"As it happened, Publius’s father was ill with fever and dysentery. Paul went in and prayed for him, and laying his hands on him, he healed him. Then all the other sick people on the island came and were healed.",4,Health,"Fever, Flu, Contagion, Healing, Interfaith, Health"
454,,Acts,Acts,14:8-10,KJV,"And there sat a certain man at Lystra, impotent in his feet, being a cripple from his mother's womb, who never had walked: The same heard Paul speak: who stedfastly beholding him, and perceiving that he had faith to be healed, Said with a loud voice, Stand upright on thy feet.  And he leaped and walked.",2,Health,"Movement, Upright, Healing, Renew, Cripple, Interfaith, Health"
453,,Hymnal,,Hymn 425:1,,"Weeping may endure for a night, But joy cometh in the morning. Our God shall wipe all tears away, For joy cometh in the morning; Sorrow and sighing flee away, For joy cometh in the morning.",3,Happiness,"Feelings, Sadness"
452,Mary Baker Eddy,Science and Health,SH,61:4-6,,"The good in human affections must have ascendency over the evil and the spiritual over the animal, or happiness will never be won.",2,Happiness,"Affection, Spiritual Affection, Pop Culture"
451,Mary Baker Eddy,Science and Health,SH,60:29-1,,"Soul has infinite resources with which to bless mankind, and happiness would be more readily attained and would be more secure in our keeping, if sought in Soul.  Higher enjoyments alone can satisfy the cravings of immortal man.",1,Happiness,"Sadness, Feelings, Pop Culture"
450,Mary Baker Eddy,Church Manual,,60:15-17,,Gratitude and love should abide in every heart each day of all the years.,1,Happiness,"Money, Gratitude"
448,Mary Baker Eddy,Science and Health,SH,477:26-29,,"Man is the expression of Soul. The Indians caught some glimpses of the underlying reality, when they called a certain beautiful lake ""the smile of the Great Spirit.""",2,Happiness,"Feelings, Depression"
447,Mary Baker Eddy,Science and Health,SH,407:17,,"Let the slave of wrong desire learn the lessons of Christian Science, and he will get the better of that desire, and ascend a degree in the scale of health, happiness, and existence.",2,Happiness,"Pop Culture, Addiction"
446,Mary Baker Eddy,Science and Health,SH,369:31,,It is error even to murmur or to be angry over sin.,4,Happiness,"Feelings, Anger"
445,Mary Baker Eddy,Science and Health,SH,304:9-14,,"This is the doctrine of Christian Science:  that divine Love cannot be deprived of its manifestation, or object; that joy cannot be turned into sorrow, for sorrow is not the master of joy; that good can never produce evil; that matter can never produce mind nor life result in death.",1,Happiness,"Feelings, Sadness"
444,Mary Baker Eddy,Miscellaneous Writings,Mis,287:12-13,,Soul is the infinite source of bliss: only high and holy joy can satisfy immortal cravings.,1,Happiness,"Pop Culture, Addiction"
443,Mary Baker Eddy,Science and Health,SH,7:18-21,,"If spiritual sense always guided men, there would grow out of ecstatic moments a higher experience and a better life with more devout self-abnegation and purity.",3,Happiness,"Purity, Happy, Joy, Sense, Arts, Passion"
442,Mary Baker Eddy,Science and Health,SH,599:4,,"ZEAL.  The reflected animation of Life, Truth, and Love. Blind enthusiasm; mortal will.",3,Happiness,"Joy, Happy, Spirit, Arts, Passion"
441,Mary Baker Eddy,Science and Health,SH,58:7,,"Unselfish ambition, noble life-motives, and purity, —  these constituents of thought, mingling, constitute individually and collectively true happiness, strength, and permanence.",1,Happiness,"Decisions, Motives"
440,Mary Baker Eddy,Science and Health,SH,57:15,,"Beauty, wealth, or fame is incompetent to meet the demands of the affections, and should never weigh against the better claims of intellect, goodness, and virtue. Happiness is spiritual, born of Truth and Love. It is unselfish; therefore it cannot exist alone, but requires all mankind to share it.",1,Happiness,"Money, Status. Friends, Popularity"
439,Mary Baker Eddy,Miscellaneous Writings,Mis,354:15,,"A little more grace, a motive made pure, a few truths tenderly told, a heart softened, a character subdued, a life consecrated, would restore the right action of the mental mechanism, and make manifest the movement of body and soul in accord with God.",4,Happiness,"Feelings, Depression"
438,Mary Baker Eddy,Science and Health,SH,265:23-26,,Who that has felt the loss of human peace has not gained stronger desires for spiritual joy? The aspiration after heavenly good comes even before we discover what belongs to wisdom and Love.,1,Happiness,"Feelings, Depression"
437,Mary Baker Eddy,Science and Health,SH,234:26,,"You must control evil thoughts in the first instance, or they will control you in the second.",2,Happiness,"Feelings, Violence"
436,Mary Baker Eddy,Miscellaneous Writings,Mis,19: 31-32,,"The spiritual sense of Life and its grand pursuits is of itself a bliss, health-giving, and joy-inspiring.",2,Happiness,"Feelings, Sadness"
435,Mary Baker Eddy,Christian Healing,Hea,10:20-23,,"If you wish to be happy, argue with yourself on the side of happiness; take the side you wish to carry, and be careful not to talk on both sides, or to argue stronger for sorrow than for joy.",1,Happiness,"Feelings, Sadness"
434,Mary Baker Eddy,Science and Health,SH,390:9,,Truth will at length compel us all to exchange the pleasures and pains of sense for the joys of Soul.,1,Happiness,"Disease, Senses, Peace, Pain"
433,,Psalms,Ps,"66: 1-4, 19-20",NIV,"Shout for joy to God, all the earth!  Sing the glory of his name;... “How awesome are your deeds!... All the earth bows down to you;..."" God has surely listened and has heard my prayer. Praise be to God, who has not rejected my prayer or withheld his love from me!",2,Happiness,"Gratitude, Praise"
432,,Psalms,Ps,63: 1-5,NLT,"O God, you are my God; I earnestly search for you.  My soul thirsts for you; my whole body longs for you in this parched and weary land where there is no water.... Your unfailing love is better than life itself;  how I praise you!...You satisfy me more than the richest feast.  I will praise you with songs of joy.",2,Happiness,"Longing, Yearning, Seeking, Praise, Satisfaction, Food"
431,,Isaiah,Isa,51:11,NLT,"Those who have been ransomed by the Lord will return. They will enter Jerusalem singing, crowned with everlasting joy. Sorrow and mourning will disappear, and they will be filled with joy and gladness.",2,Happiness,"Tough Stuff, Grief"
430,,Psalms,Ps,35: 9-10,MSG,"But let me run loose and free, celebrating God's great work, every bone in my body laughing, singing, ""God,  there's no one like you. You put the down-and-out on their feet and protect the unprotected from bullies!""",2,Happiness,"Feelings, Sadness"
429,,Proverbs,Prov,17:22,NLT,"A cheerful heart is good medicine, but a broken spirit saps a person’s strength.",1,Happiness,"Feelings, Sadness"
428,,I John,l John,1:5,KJV,"...God is light, and in him is no darkness at all.",2,Happiness,"Feelings, Depression"
427,,Ecclesiastes,Eccl,9:7-10,MSG,"Seize life!... Oh yes—God takes pleasure in your pleasure!  Dress festively every morning.   Don't skimp on colors and scarves....  Each day is God's gift....  Make the most of each one!  Whatever turns up, grab it and do it. And heartily!",2,Happiness,"Clothes, Joy, Arts, Passion, Body Image, Beauty, Courage, Control"
426,Paul,Galatians,Gal,5:22-23,CEV,"God's Spirit makes us loving, happy, peaceful, patient, kind, good, faithful, gentle, and self-controlled.",1,Happiness,"Feelings, Moody"
425,,Genesis,Gen,21:6,AMP,"And Sarah said, God has made me to laugh; all who hear will laugh with me.",2,Happiness,"Humor, Laugh, Direction, Guidance, Feelings, Sadness"
424,,Psalms,Ps,16:11,NLT,"You will show me the way of life, granting me the joy of your presence and the pleasures of living with you forever.",2,Happiness,"Companionship, Spirituality, Path"
423,Mary Baker Eddy,"The First Church of Christ, Scientist, and Miscellany",My,164:10,,"What is gratitude but a powerful camera obscura, a thing focusing light where love, memory, and all within the human heart is present to manifest light.",2,Gratitude,"Money, Gratitude"
422,Mary Baker Eddy,Science and Health,SH,3:25,,Gratitude is much more than a verbal expression of thanks. Action expresses more gratitude than speech.,1,Gratitude,"Money, Gratitude"
421,Mary Baker Eddy,Miscellaneous Writings,Mis,xi:8,,"While no offering can liquidate one's debt of gratitude to God, the fervent heart and willing hand are not unknown to nor unrewarded by Him.",2,Gratitude,"Intelligence, Money, Debts"
419,Mary Baker Eddy,Science and Health,SH,3:32,,"While the heart is far from divine Truth and Love, we cannot conceal the ingratitude of barren lives.",2,Gratitude,"Money, Gratitude"
418,Mary Baker Eddy,"First Church of Christ, Scientist, and Miscellany",My,165:26-28,,He who is afraid of being too generous has lost the power of being magnanimous. The best man or woman is the most unselfed.,2,Gratitude,"Giving, Money"
417,Jesus,John,John,6:9-13,NIV,"“Here is a boy with five small barley loaves and two small fish...” Jesus... then took the loaves, gave thanks, and distributed to those who were seated... He did the same with the fish. When they had all had enough to eat... they... filled twelve baskets with the pieces of the five barley loaves left over...",3,Gratitude,"Money, Needs"
416,,Psalms,Ps,145:16,NIV,You open your hand and satisfy the desires of every living thing.,2,Gratitude,"Pop Culture, Addiction"
415,,Luke,Luke,12:15,NIV,"Then he said to them, “Watch out! Be on your guard against all kinds of greed; life does not consist in an abundance of possessions.",3,Gratitude,"Money, Materialism"
414,,Ecclesiastes,Eccl,11:1-2,MSG,Be generous: Invest in acts of charity. Charity yields high returns. Don't hoard your goods; spread them around. Be a blessing to others.,2,Gratitude,"Money, Giving"
413,Paul,II Corinthians,ll Cor,9:10-11,NCV,God… gives seed to the farmer and bread for food. He will give you all the seed you need and make it grow so there will be a great harvest from your goodness. He will make you rich in every way so that you can always give freely. And your giving… will cause many to give thanks to God.,3,Gratitude,"Giving, Money, Gratitude, Growth, Fruitage, Wealth"
412,Paul,II Corinthians,ll Cor,4:15,KJV,"For all things are for your sakes, that the abundant grace might through the thanksgiving of many redound to the glory of God.",2,Gratitude,"Giving, Money, Gratitude"
411,,Isaiah,Isa,40:26,KJV,"Lift up your eyes on high, and behold who hath created these things... he calleth them all by names by the greatness of his might, for that he is strong in power; not one faileth.",2,God,"Failure, Success, Identity, Strength, Understanding, Seeing, Creator"
410,,Psalms,Ps,100:3,KJV,"Know ye that the Lord he is God: it is he that hath made us, and not we ourselves; we are his people, and the sheep of his pasture.",2,God,"Understanding, Creator, Origin, Ancestor, Guide, Sheep, Spirituality, Me, Creator"
409,,Genesis,Gen,1:1,KJV,In the beginning God created the heaven and the earth.,1,God,"Source, Start, Foundation, Parents, Spirituality, Creator"
408,Mary Baker Eddy,Science and Health,SH,256:7-8,,"Love, the divine Principle, is the Father and Mother of the universe, including man.",1,God,"Love, Family, Parents, Children, Universal, Creator, Pregnancy"
407,Mary Baker Eddy,Science and Health,SH,vii:20,,"Though empires fall, “the Lord shall reign forever.”",1,God,"Permenance, World, Government"
406,Mary Baker Eddy,Science and Health,SH,6:17-18,,"""God is Love."" More than this we cannot ask, higher we cannot look, farther we cannot go.",1,God,"Interfaith, God"
405,Mary Baker Eddy,Science and Health,SH,517:15-19,,"The world believes in many persons; but if God is personal, there is but one person, because there is but one God. His personality can only be reflected, not transmitted. God has countless ideas, and they all have one Principle and parentage.",3,God,"Reflection, Creator, Individuality, Heredity, Pop Culture, Celebrity"
404,Mary Baker Eddy,Science and Health,SH,465:9,,"God is incorporeal, divine, supreme, infinite Mind, Spirit, Soul, Principle, Life, Truth, Love.",1,God,"Interfaith, God"
403,Mary Baker Eddy,Science and Health,SH,410:5,,"'This is life eternal,' says Jesus, — is, not shall be; and then he defines everlasting life as a present knowledge of his Father and of himself, — the knowledge of Love, Truth, and Life. 'This is life eternal, that they might know Thee, the only true God, and Jesus Christ, whom Thou hast sent.'",3,God,"Eternity, Intelligence, Love, Life, Jesus"
402,Mary Baker Eddy,Science and Health,SH,361:16-18,,"As a drop of water is one with the ocean, a ray of light one with the sun, even so God and man, Father and son, are one in being.",4,Identity,"Tough Stuff, Divorce"
401,Mary Baker Eddy,Science and Health,SH,336:23-24,,"Allness is the measure of the infinite, and nothing less can express God.",2,God,"Omnipresence, Allness, Interfaith, God"
400,Mary Baker Eddy,Science and Health,SH,287:13-16,,"God being everywhere and all-inclusive, how can He be absent or suggest the absence of omnipresence and omnipotence?  How can there be more than all?",2,God,"Omnipresence, Allness, Interfaith, God"
399,Mary Baker Eddy,Miscellaneous Writings,Mis,157:15,,"...my Father is your Father; and He helps us most when help is most needed, for He is the ever-present help.",2,God,"Family, Parents, Love, Life, Disease, Cheating, Peer Pressure, Rape, Pregnancy"
398,Mary Baker Eddy,Miscellaneous Writings,Mis,150:25-29,,"God is universal; confined to no spot, defined by no dogma, appropriated by no sect. Not more to one than to all, is God demonstrable as divine Life, Truth, and Love; and His people are they that reflect Him — that reflect Love.",2,God,"Infinity, Reflect, Universe, Allness, Oneness"
397,,Hebrews,Heb,12:5-7,MSG,"... have you forgotten how good parents treat children...? My dear child, don't shrug off God's discipline, but don't be crushed by it either. It's the child he loves that he disciplines; the child he embraces, he also corrects. God is educating you; that's why you must never drop out. He's treating you as dear children.",3,God,"Children, Parents, Discipline, Obedience, Trust, Growth, Education"
396,Paul,II Corinthians,ll Cor,5:18,KJV,"And all things are of God, who hath reconciled us to himself by Jesus Christ, and hath given to us the ministry of reconciliation;",2,God,"Interfaith, Atonement"
395,Paul,I Corinthians,1 Cor,13:12,CEV,"Now all we can see of God is like a cloudy picture in a mirror.  Later we will see him face to face.  We don't know everything, but then we will, just as God completely understands us.",2,God,"Spirituality, Matter"
394,,Psalms,Ps,90: 2,NLT,"Before the mountains were born, before you gave birth to the earth and the world, from beginning to end, you are God.",1,God,"Infinity, Pregnancy, Earth, Omnipresence, Allness"
393,Paul,Romans,Rom,6:23,MSG,"But now that you've found you don't have to listen to sin tell you what to do, and have discovered the delight of listening to God telling you, what a surprise! A whole, healed, put-together life right now, with more and more of life on the way! ....But God's gift is real life, eternal life, delivered by Jesus, our Master.",3,God,"Sin, Life, Death, Purpose, Disease, Cheating, Peer Pressure, Anger, Self-hate, Rape, Pregnancy, Pornography"
392,,Deuteronomy,Deut,5:11,MSG,"No using the name of God, your God, in curses or silly banter; God won't put up with the irreverent use of his name.",2,God,"Cursing, Swearing, Friends, Gossip"
391,,Ephesians,Eph,4:5,NLT,"There is one Lord, one faith, one baptism,",2,God,"Infinity, Substance, Unity, Oneness, Omnipresence"
390,,Ecclesiastes,Eccl,3:14,NIV,I know that everything God does will endure forever; nothing can be added to it and nothing taken from it.,1,God,"Infinity, Substance, Unity, Oneness, Omnipresence"
389,,Leviticus,Lev,26:1,MSG,"Don't make idols for yourselves; don't set up an image or a sacred pillar for yourselves, and don't place a carved stone in your land that you can bow down to in worship. I am God, your God.",2,God,"Faith, Pop Culture, Idols, Pornography"
388,,Psalms,Ps,18:2,NKJV,"The Lord is my rock and my fortress and my deliverer; My God, my strength, in whom I will trust; My shield and the horn of my salvation.",1,God,"Safety, Trust, Protection, Salvation, Rape, Abuse"
387,,Psalms,Ps,17:6,MSG,"I call to you, God, because I'm sure of an answer. So—answer! bend your ear! listen sharp! Paint grace-graffiti on the fences; take in your frightened children who are running from the neighborhood bullies straight to you.",3,God,"Savior, Bully, Safety, Gratitude, Parents, Children"
386,,Psalms,Ps,"107: 28, 30-31",MSG,"You called out to God in your desperate condition; he got you out in the nick of time. And you were so glad when the storm died down, and he led you safely back to harbor.  So thank God for his marvelous love, for his miracle mercy to the children he loves.",2,God,"Savior, Storm, Safety, Gratitude, Parents, Children, Feelings, Discouragement, Pregnancy"
385,,Isaiah,Isa,45:5,KJV,"I am the Lord, and there is none else, there is no God beside me.",1,God,"Infinity, Substance, Unity, Oneness, Omnipresence, Interfaith, God"
384,,Deuteronomy,Deut,4:39,KJV,"Know therefore this day, and consider it in thine heart, that the Lord he is God in heaven above, and upon the earth beneath: there is none else.",1,God,"Faith, Understanding, Heaven, Earth, Interfaith, God"
383,,1 John,l John,4:16,NIV,"And so we know and rely on the love God has for us. God is love. Whoever lives in love lives in God, and God in them.",1,God,"Family, Parents, Love, Life, Peer Pressure, Anger, Self-hate, Interfaith, God, Rape, Pregnancy, Disease, Cheating"
382,,Jeremiah,Jer,31:3,KJV,"The Lord hath appeared of old unto me, saying, Yea, I have loved thee with an everlasting love: therefore with lovingkindness have I drawn thee.",1,God,"Life, Parents, Affection, Interfaith, God"
381,Moses,Exodus,Ex,20:3,MSG,"No other gods, only me.",2,God,"Infinity, Substance, Unity, Oneness, Omnipresence, Pop Culture, Idols"
380,,Revelation,Rev,3:8,NLT,"I know all the things you do, and I have opened a door for you that no one can close.",1,Future,"Intelligence, Plan, Pregnancy, Purpose"
379,Mary Baker Eddy,Science and Health,SH,84:7-10,,"When sufficiently advanced in Science to be in harmony with the truth of being, men become seers and prophets involuntarily, controlled not by demons, spirits, or demigods, but by the one Spirit.",2,Future,"Harmony, Magic, Demon"
378,Mary Baker Eddy,Science and Health,SH,84:3-7,,"The ancient prophets gained their foresight from a spiritual, incorporeal standpoint, not by foreshadowing evil and mistaking fact for fiction, — predicting the future from a groundwork of corporeality and human belief.",3,Future,"Matter, Magic"
377,Mary Baker Eddy,Science and Health,SH,84:11,,"It is the prerogative of the ever-present, divine Mind, and of thought which is in rapport with this Mind, to know the past, the present, and the future.",2,Future,"Past, Present, Plan, Decisions"
376,Mary Baker Eddy,Science and Health,SH,593:4-5,,Prophet: A spiritual seer; disappearance of material sense before the conscious facts of spiritual Truth.,2,Future,"Sense, Matter, Materiality"
375,Mary Baker Eddy,Science and Health,SH,426:8-9,,"When the destination is desirable, expectation speeds our progress.",1,Future,"Disease, Anger, Self-hate, Plan, Progress, Pornography"
374,Mary Baker Eddy,Miscellaneous Writings,Mis,397:22,,"Shepherd, show me how to go   O'er the hillside steep,   How to gather, how to sow, —    How to feed Thy sheep;   I will listen for Thy voice,   Lest my footsteps stray;   I will follow and rejoice   All the rugged way.",1,Future,"Disease, Cheating, Peer Pressure, Anger, Self-hate, Rape, Pregnancy, Pornography"
373,Mary Baker Eddy,Science and Health,SH,323:9,,"Beholding the infinite tasks of truth, we pause, — wait on God. Then we push onward, until boundless thought walks enraptured, and conception unconfined is winged to reach the divine glory.",3,Future,"Infinite, Patience, Anxiety, Money, Opportunity"
