ID,Author,Book,Book Abbrev.,Citation,Translation,Quotes,Rate,Topics,Tags
1664,Mary Baker Eddy,Science and Health,SH,240:2,,"Arctic regions, sunny tropics, giant hills, winged winds, mighty billows, verdant vales, festive flowers, and glorious heavens, — all point to Mind, the spiritual intelligence they reflect. The floral apostles are hieroglyphs of Deity....The stars make night beautiful, and the leaflet turns naturally towards the light.",3,Travel,"Travel, Peace"
1663,,,Phil,4:13,PHILLIPS,I am ready for anything through the strength of the one who lives within me.,1,Travel,"Adventure, Fear, Travel"
1662,,Psalms,Ps,73:24,MSG,"You wisely and tenderly lead me, and then you bless me.",1,Travel,"Wisdom, Travel, Guide, Lost"
1661,Mary Baker Eddy,Miscellaneous Writings,Mis,157:15,,"...my Father is your Father; and He helps us most when help is most needed, for He is the ever-present help.",3,Travel,"Travel, Adventure, Help"
1660,,Zephaniah,Zeph,3:17,KJV,"The Lord thy God in the midst of thee is mighty; he will save, he will rejoice over thee with joy; he will rest in his love, he will joy over thee with singing.",3,Travel,"Travel, Peace, Fear, Home"
1659,Mary Baker Eddy,Science and Health,SH,44:10-12,,"Step by step will those who trust Him find that ""God is our refuge and strength, a very present help in trouble.""",1,Travel,"Safety, Travel"
1658,Mary Baker Eddy,Miscellaneous Writings,Mis,81:25-29,NIV,"In the desolation of human understanding, divine Love hears and answers the human call for help; and the voice of Truth utters the divine verities of being which deliver mortals out of the depths of ignorance and vice.",3,Travel,"Safety, Travel"
1657,,Psalms,Ps,139:9-10,MSG,"Is there anyplace I can go to avoid your Spirit? to be out of your sight? If I climb to the sky, you're there! If I go underground, you're there! If I flew on morning's wings to the far western horizon, You'd find me in a minute— you're already there waiting!",2,Travel,"Travel, Adventure, Help"
1656,Mary Baker Eddy,Miscellaneous Writings,Mis,41:26-28,,"The divine Principle which governs the universe, including man, if demonstrated, is sufficient for all emergencies.",2,Travel,"Travel, Fear, Help, Rape, Cheating, Gangs, Bullying"
1655,,Psalms,Ps,46:1,NIV,"God is our refuge and strength, an ever-present help in trouble.",1,Travel,"Travel, Fear, Help"
1654,,Ephesians,Eph,2:19,KJV,"Now therefore ye are no more strangers and foreigners, but fellow-citizens with the saints, and of the household of God.",1,Travel,"Travel, Safety, Neighbor, Stranger, Homelessness, World, Culture, Gangs, Bullying, Peer Pressure"
1653,Mary Baker Eddy,Science and Health,SH,283:4-6,,"Mind is the source of all movement, and there is no inertia to retard or check its perpetual and harmonious action.",1,Travel,"World, Travel"
1652,,Psalms,Ps,121: 8,KJV,"The Lord shall preserve thy going out and thy coming in from this time forth, and even for evermore.",1,Travel,"World, Travel"
1651,Mary Baker Eddy,Miscellaneous Writings,Mis,347:26-27,,"Those who know no will but His take His hand, and from the night He leads to light.",1,Decisions,"Self, Purpose"
1650,Mary Baker Eddy,Miscellaneous Writings,Mis,230:8-12,,"Three ways of wasting time, one of which is contemptible, are gossiping mischief, making lingering calls, and mere motion when at work, thinking of nothing or planning for some amusement, — travel of limb more than mind.",4,Travel,"Friends, Gossip"
1649,Paul,I Thessalonians,l Thess,5:12-13,NLT,"Dear brothers and sisters, honor those who are your leaders in the Lord’s work. They work hard among you and give you spiritual guidance. Show them great respect and wholehearted love because of their work. And live peacefully with each other.",4,Jobs,"Interfaith, Prayer, Leadership, Work, Mission, Love, Harmony"
1648,,Psalms,Ps,"107: 28, 30-31",MSG,"You called out to God in your desperate condition; he got you out in the nick of time. And you were so glad when the storm died down, and he led you safely back to harbor.  So thank God for his marvelous love, for his miracle mercy to the children he loves.",2,Travel,"Savior, Storm, Safety, Gratitude, Parents, Children, Feelings, Discouragement, Travel, Pregnancy"
1647,,Ephesians,Eph,4:4,MSG,"You were all called to travel on the same road and in the same direction, so stay together, both outwardly and inwardly. You have one Master, one faith, one baptism, one God and Father of all, who rules over all, works through all, and is present in all. Everything you are and think and do is permeated with Oneness.",2,Travel,"Travel, Direction, Faith, Baptism, Oneness"
1646,Mary Baker Eddy,Miscellaneous Writings,Mis,397:22,,"Shepherd, show me how to go   O'er the hillside steep,   How to gather, how to sow, —    How to feed Thy sheep;   I will listen for Thy voice,   Lest my footsteps stray;   I will follow and rejoice   All the rugged way.",1,Direction,"Purpose, Guidance, World"
1645,,Exodus,Ex,23:20,KJV,"Behold, I send an Angel before thee, to keep thee in the way, and to bring thee into the place which I have prepared.",1,Travel,"Purpose, Guidance, Progress, Safety, World, Travel"
1644,,Psalms,Ps,139:7-10,KJV,"Whither shall I go from thy spirit? or whither shall I flee from thy presence? If I ascend up into heaven, thou art there: if I make my bed in hell, behold, thou art there. If I take the wings of the morning, and dwell in the uttermost parts of the sea; Even there shall thy hand lead me, and thy right hand shall hold me.",2,Travel,"Hand, Heaven, Protection, Omnipresence, World, Travel"
1643,,Proverbs,Prov,3:5-6,KJV,"Trust in the Lord with all thine heart; and lean not unto thine own understanding. In all thy ways acknowledge him, and he shall direct thy paths.",2,Fear,"Guidance, Path, Decisions, Direction"
1642,Mary Baker Eddy,Miscellaneous Writings,Mis,150:10,,Space is no separator of hearts.,1,Death,"Love, Friends, Family, World"
1641,,Psalms,Ps,7:10,CEV,"You, God, are my shield, the protector of everyone whose heart is right.",1,Travel,
1640,,Isaiah,Isa,61:10,,"I will greatly rejoice in the Lord, my soul shall by joyful in my God; for he hath clothed me with the garments of salvation, he hath covered me with the robe of righteousness",2,Looks,
1639,,Colossians,Col,3:12,NIV,"Therefore, as God’s chosen people, holy and dearly loved, clothe yourselves with compassion, kindness, humility, gentleness and patience.",1,Looks,
1638,,Rudimental Divine Science,Rud,6:06,,"All beauty and goodness are in and of Mind, emanating from God; but when we change the nature of beauty and goodness from Mind to matter, the beauty is marred, through a false conception, and, to the material senses, evil takes the place of good.",3,Looks,
1637,,Science and Health,SH,264:10,,"We must look where we would walk, and we must act as possessing all power from Him in whom we have our being.",2,Travel,
1636,,Science and Health,SH,264:7-10,,"Mortals must look beyond fading, finite forms, if they would gain the true sense of things. Where shall the gaze rest but in the unsearchable realm of Mind?",2,Looks,
1635,,Science and Health,SH,360:2-5,,"Human lives are yet uncarved, — in the rough marble, encumbered with crude, rude fragments, and awaiting the hammering, chiselling, and transfiguration from His hand.",1,Looks,
1634,Paul,II Corinthians,II Cor,4:18,NIV,"So we fix our eyes not on what is seen, but on what is unseen, since what is seen is temporary, but what is unseen is eternal.",1,Looks,
1633,,Psalms,Ps,17:15,,"As for me, I will behold thy face in righteousness: I shall be satisfied, when I awake, with thy likeness",1,Looks,
1632,Mary Baker Eddy,Science and Health,SH,223:3,,"Sooner or later we shall learn that the fetters of man's finite capacity are forged by the illusion that he lives in body instead of in Soul, in matter instead of in Spirit.",3,Progress,
1631,Mary Baker Eddy,"Message to the Mother Church, 1902",Msg 00,2:7-8,,"The song of Christian Science is, ""Work — work — work — watch and pray.""",3,Progress,
1630,Mary Baker Eddy,Science and Health,SH,128:14,,"A knowledge of the Science of being develops the latent abilities and possibilities of man. It extends the atmosphere of thought, giving mortals access to broader and higher realms. It raises the thinker into his native air of insight and perspicacity.",2,Progress,
1629,Mary Baker Eddy,Science and Health,SH,226:29,,"I saw before me the awful conflict, the Red Sea and the wilderness; but I pressed on throught faith in God, trusting Truth, the strong deliverer, to guide me into the land of Christian Science, where fetters fall and the rights of man are fully known and acknowledged",2,Progress,
1628,Mary Baker Eddy,No and Yes,No,16:1-6,,"For God to know, is to be; that is, what He knows must truly and eternally exist.",1,God,
1627,,Revelation,Rev,2:7,NKJV,"To him who overcomes I will give to eat from the tree of life, which is in the midst of the Paradise of God",2,Progress,
1626,Mary Baker Eddy,Science and Health,SH,258:13-15,,"God expresses in man the infinite idea forever developing itself, broadening and rising higher and higher from a boundless basis.",2,Sports,
1625,Mary Baker Eddy,Miscellaneous Writings,Mis,10:10-13,,"Their God will not let them be lost; and if they fall they shall rise again, stronger than before the stumble. The good cannot lose their God, their help in times of trouble.",3,Sports,Losing
1624,Mary Baker Eddy,Miscellaneous Writings,Mis,138:17-19,,"I once thought that in unity was human strength; but have grown to know that human strength is weakness, — that unity is divine might, giving to human power, peace.",3,Sports,Teamwork
1623,Mary Baker Eddy,Science and Health,SH,128:8-16,,"…Christian Science enhances their endurance and mental powers…gives them acuteness and comprehensiveness and an ability to exceed their ordinary capacity. The human mind, imbued with this spiritual understanding, becomes more elastic, is capable of greater endurance, escapes somewhat from itself, and requires less repose. A knowledge of the Science of being develops the latent abilities and possibilities of man.",3,Sports,
1622,,Science and Health,SH,514:6-9,,"Mind, joyous in strength, dwells in the realm of Mind. Mind's infinite ideas run and disport themselves. In humility they climb the heights of holiness.",3,Sports,
1621,Mary Baker Eddy,Science and Health,SH,385:17,,"Whatever it is your duty to do, you can do without harm to yourself. If you sprain the muscles or wound the flesh, your remedy is at hand. Mind decides whether or not the flesh shall be discolored, painful, swollen, and inflamed.",3,Sports,
1620,,,II Cor,3:18,PHILLIPS,"Let no one be under any illusion over this. If any man among you thinks himself one of the world’s clever ones, let him discard his cleverness that he may learn to be truly wise. For this world’s cleverness is stupidity to God.",2,Self-worth,
1619,,Isaiah,Isa,43:4,CEV,"To me, you are very dear, and I love you.
That’s why I gave up nations and people to rescue you. Don’t be afraid! I am with you. From both east and west I will bring you together.",4,Self-worth,
1618,Mary Baker Eddy,"The First Church of Christ, Scientist, and Miscellany",My,165:16,,"As an active portion of one stupendous whole, goodness identifies man with universal good. Thus may each member of this church rise above the oft-repeated inquiry, What am I? to the scientific response:  I am able to impart truth, health, and happiness, and this is my rock of salvation and my reason for existing.",2,Self-worth,
1617,,Genisis,Gen,1:26,ESV,"Then God said, “Let us make man in our image, after our likeness. And let them have dominion...""",1,Self-worth,
1616,,Miscellaneous Writings,Mis,183:21-28,,"...divine Science unfolds omnipotence, that equips man with divine power while it shames human pride….selfhood apart from God, is a denial of man's spiritual sonship; for it claims another father. As many as do receive a knowledge of God through Science, will have power to reflect His power, in proof of man's ""dominion over all the earth.""",2,Self-worth,
1615,,John,John,5:30,PHILLIPS,"By myself I can do nothing…I do not live to please myself but to do the will of the Father...You may say that I am bearing witness about myself, that…what I say about myself has no value, but I would remind you that there is one who witnesses about me and I know that his witness about me is absolutely true.",2,Self-worth,
1614,Mary Baker Eddy,Unity of Good,Un,55:9-15,,"He was the Way-shower; and Christian Scientists who would demonstrate ""the way"" must keep close to his path, that they may win the prize... ""The way,"" in Spirit, is ""the way"" of Life, Truth, and Love, redeeming us from the false sense of the flesh and the wounds it bears.",2,Progress,
1613,Mary Baker Eddy,Science and Health,SH,151:17,,"All that really exists is the divine Mind and its idea, and in this Mind the entire being is found harmonious and eternal. The straight and narrow way is to see and acknowledge this fact, yield to this power, and follow the leadings of truth.",3,Progress,
1612,Mary Baker Eddy,Science and Health,SH,49:15,,"The meek demonstrator of good, the highest instructor and friend of man, met his earthly fate alone with God.",3,Loneliness,
1611,Mary Baker Eddy,Science and Health,SH,44:5-7,,"The lonely precincts of the tomb gave Jesus a refuge from his foes, a place in which to solve the great problem of being.",3,Loneliness,
1610,,Matthew,Matt,25:20-21,NKJV,"So he who had received five talents came and brought five other talents, saying, ‘Lord, you delivered to me five talents; look, I have gained five more talents besides them.’ His lord said to him, ‘Well done, good and faithful servant; you were faithful over a few things, I will make you ruler over many things.",2,Jobs,
1609,,Matthew,Matt,7:1-2,NIV,"Do not judge, or you too will be judged. For in the same way you judge others, you will be judged, and with the measure you use, it will be measured to you.",3,Jobs,
1608,,Hebrews,Heb,11:1,KJV,"Now faith is the substance of things hoped for, the evidence of things not seen.",2,Jobs,
1607,Mary Baker Eddy,Science and Health,SH,483:30,,"One must fulfil one's mission without timidity or dissimulation, for to be well done, the work must be done unselfishly.",2,Jobs,
1606,,John,John,8:54,MSG,"Jesus said, ""If I turned the spotlight on myself, it wouldn't amount to anything. But my Father, the same One you say is your Father, put me here at this time and place….I do know, and I am doing what he says. Abraham…with jubilant faith looked down the corridors of history and saw my day coming. He saw it and cheered.""",2,Jesus,
1605,,Revelation,Rev,11:17,NKJV,"We give You thanks, O Lord God Almighty, the One who is and who was and who is to come, because You have taken Your great power and reigned.",2,Gratitude,
1604,Mary Baker Eddy,Science and Health,SH,570:24,,Those ready for the blessing you impart will give thanks.,2,Gratitude,
1603,,Psalms,Ps,136:1,KJV,O give thanks unto the Lord; for he is good: for his mercy endureth for ever.,1,Gratitude,
1602,,Luke,Luke,23:34,KJV,"Then said Jesus, Father, forgive them; for they know not what they do.",2,Forgiveness,
1601,Mary Baker Eddy,Science and Health,SH,205:22,,"When we realize that there is one Mind, the divine law of loving our neighbor as ourselves is unfolded; whereas a belief in many ruling minds hinders man's normal drift towards the one Mind, one God, and leads human thought into opposite channels where selfishness reigns.",3,Forgiveness,
1600,,Colossians,Col,3:13,NIV,Bear with each other and forgive one another if any of you has a grievance against someone. Forgive as the Lord forgave you.,1,Forgiveness,
1599,Mary Baker Eddy,Science and Health,SH,9:5-11,,"The test of all prayer lies in the answer to these questions: Do we love our neighbor better because of this asking? Do we pursue the old selfish-ness, satisfied with having prayed for something better, though we give no evidence of the sincerity of our requests by living consistently with our prayer?",3,Forgiveness,
1598,,II Timothy,II Tim,1:7,KJV,"For God hath not given us the spirit of fear; but of power, and of love, and of a sound mind.",1,Fear,
1597,Mary Baker Eddy,Science and Health,SH,96:15,,"The breaking up of material beliefs may seem to be famine and pestilence, want and woe, sin, sickness, and death, which assume new phases until their nothingness appears. These disturbances will continue until the end of error, when all discord will be swallowed up in spiritual Truth.",2,Death,"Tough Stuff, Tragedy"
1596,Mary Baker Eddy,Miscellaneous Writings,Mis,10:10-13,,"Their God will not let them be lost; and if they fall they shall rise again, stronger than before the stumble. The good cannot lose their God, their help in times of trouble.",2,Death,"Sports, Losing"
1595,,Psalms,Ps,139:7-10,NKJV,"Where can I go from Your Spirit? Or where can I flee from Your presence? If I ascend into heaven, You are there; If I make my bed in hell, behold, You are there. If I take the wings of the morning, And dwell in the uttermost parts of the sea, Even there Your hand shall lead me, And Your right hand shall hold me.",2,Death,"Tough Stuff, Tragedy"
1594,,John,John,3:16,KJV,"For God so loved the world, that he gave his only begotten Son, that whosoever believeth in him should not perish, but have everlasting life.",1,Death,"Interfaith, Jesus Christ"
1593,Mary Baker Eddy,Science and Health,SH,26:14,,"Divine Truth, Life, and Love gave Jesus authority over sin, sickness, and death. His mission was to reveal the Science of celestial being, to prove what God is and what He does for man.",2,Death,"Interfaith, Jesus Christ"
1592,Mary Baker Eddy,Miscellaneous Writings,Mis,157:26,,"Error has no power but to destroy itself. It cannot harm you; it cannot stop
the eternal currents of Truth.",2,Death,"Fear, Achievement, Progress, Success, Failure, Faith, Sports, Confidence"
1591,Mary Baker Eddy,"The First Church of Christ, Scientist, and Miscellany",My,149:31-2,,"Remember, thou canst be brought into no condition, be it ever so severe, where Love has not been before thee and where its tender lesson is not awaiting thee.",1,Death,"Tough Stuff, Pregnancy"
1590,Mary Baker Eddy,Science and Health,SH,310:14,,"Science reveals Soul as God, untouched by sin and death, — as the central Life and intelligence around which circle harmoniously all things in the systems of Mind.",2,Death,"Unity, Harmony, Peace, Nightmares, Dreams, Anger"
1589,Mary Baker Eddy,Miscellaneous Writings,Misc,147:19,,The upright man is guided by a fixed Principle...,1,Travel,"Vacation, Trips, Touring, Flying, Adventure, Culture, Foreign, Abroad"
1588,,Leviticus,Lev,19:34,ESV,"You shall treat the stranger who sojourns with you as the native among you, and you shall love him as yourself...",1,Travel,"Vacation, Trips, Touring, Flying, Adventure, Culture, Foreign, Abroad"
1587,Paul,Ephesians,Eph,2:19,NLT,So now you Gentiles are no longer strangers and foreigners. You are citizens along with all of God’s holy people. You are members of God’s family.,1,Travel,
1586,Mary Baker Eddy,Miscellaneous Writings,Misc,328:26-29,,"Therefore, give up thy earth-weights; and observe the apostle's admonition, ""Forgetting those things which are behind, and reaching forth unto those which are before.""",3,Travel,"Vacation, Trips, Touring, Flying, Adventure, Culture, Foreign, Abroad"
1584,Mary Baker Eddy,Miscellaneous Writings,Misc,155:7,,"Forget self in laboring for mankind; then          will you woo the weary wanderer to your door, win the pilgrim and stranger to your church, and find access to          the heart of humanity.",3,Travel,"Vacation, Trips, Touring, Flying, Adventure, Culture, Foreign, Abroad"
1583,Mary Baker Eddy,Genesis,Gen,1:10,NLT,God called the dry ground “land” and the waters “seas.” And God saw that it was good.,3,Travel,"Vacation, Trips, Touring, Flying, Adventure, Culture, Foreign, Abroad"
1582,,Isaiah,Isa,26:3,,"Thou wilt keep him in perfect peace, whose mind is stayed on thee:  because he trusteth in thee.",2,Travel,"Vacation, Trips, Touring, Flying, Adventure, Culture, Foreign, Abroad"
1581,Mary Baker Eddy,"The First Church of Christ, Scientist, and Miscellany",My,210:7,,Good thoughts are an impervious armor; clad therewith you are completely shielded from the attacks of error of every sort.,1,Travel,"Vacation, Trips, Touring, Flying, Adventure, Culture, Foreign, Abroad"
1580,,Isaiah,Isa,35:8,ESV,"And an highway shall be there, and a way, and it shall be called The way of holiness...",1,Travel,"Vacation, Trips, Touring, Flying, Adventure, Culture, Foreign, Abroad"
1579,Mary Baker Eddy,Science and Health,SH,424:5,,"Accidents are unknown to God, or immortal Mind, and we must leave the mortal basis of belief and unite with the one Mind, in order to change the notion of chance to the proper sense of God's unerring direction and thus bring out harmony.",2,Travel,"Vacation, Trips, Touring, Flying, Adventure, Culture, Foreign, Abroad"
1578,,Isaiah,Isa,59:1,ESV,"""The Lord's hand is not shortened, that it cannot save.""",2,Travel,"Vacation, Trips, Touring, Flying, Adventure, Culture, Foreign, Abroad"
1577,Mary Baker Eddy,Miscellaneous Writings,Misc,362:25,,We all must find shelter from the storm and tempest in the tabernacle of Spirit,3,Travel,"Vacation, Trips, Touring, Flying, Adventure, Culture, Foreign, Abroad"
1576,,Luke,Luke,8:23-25,KJV,"…there came down a storm of wind on the lake; and they…were in jeopardy….Then he arose, and rebuked the wind and the raging of the water…and there was a calm….they being afraid wondered, saying one to another, What manner of man is this! for he commandeth even the winds and water, and they obey him.",2,Travel,"Vacation, Trips, Touring, Flying, Adventure, Culture, Foreign, Abroad"
1575,,Deuteronomy,Deut,33:27,KJV,"The eternal God is thy refuge, and underneath are the everlasting arms: and he shall thrust out the enemy from before thee; and shall say, Destroy them.",1,Travel,"Vacation, Trips, Touring, Flying, Adventure, Culture, Foreign, Abroad"
1574,Mary Baker Eddy,Science and Health,SH,581:8-9,,"Ark. Safety; the idea, or reflection, of Truth, proved to be as immortal as its Principle ...",1,Travel,"Vacation, Trips, Touring, Flying, Adventure, Culture, Foreign, Abroad"
1573,,Psalms,Ps,121:7-8,KJV,"The Lord shall preserve thee from all evil: he shall preserve thy soul. The Lord shall preserve thy going out and thy coming in from this time forth, and even for evermore.",4,Travel,"Vacation, Trips, Touring, Flying, Adventure, Culture, Foreign, Abroad"
1572,,Psalms,Ps,91:1,NIV,Whoever dwells in the shelter of the Most High will rest in the shadow of the Almighty.,2,Travel,"Vacation, Trips, Touring, Flying, Adventure, Culture, Foreign, Abroad"
1571,Mary Baker Eddy,"The First Church of Christ, Scientist, and Miscellany",My,158:9,,We live in an age of Love's divine adventure to be All-in-all.,1,Travel,"Vacation, Trips, Touring, Flying, Adventure, Culture, Foreign, Abroad"
1570,,Psalms,Ps,91:9-12,KJV,"Because thou hast made the Lord, which is my refuge, even the most High, thy habitation; There shall no evil befall thee, neither shall any plague come nigh thy dwelling. For he shall give his angels charge over thee, to keep thee in all thy ways. They shall bear thee up in their hands, lest thou dash thy foot against a stone.",4,Travel,"Vacation, Trips, Touring, Flying, Adventure, Culture, Foreign, Abroad"
1569,,Psalms,Ps,139:7-12,MSG,"Is there anyplace I can go to avoid your Spirit? to be out of your sight? If I climb to the sky, you're there!  If I go underground, you're there!  If I flew on morning's wings to the far western horizon, You'd find me in a minute—you're already there waiting!",4,Travel,"Vacation, Trips, Touring, Flying, Adventure, Culture, Foreign, Abroad"
1567,,John,John,4:24,KJV,God is a Spirit: and they that worship him must worship him in spirit and in truth.,1,God,
1566,Mary Baker Eddy,Science and Health,SH,180:25-27,,"When man is governed by God, the ever-present Mind who understands all things, man knows that with God all things are possible.",1,Confidence,
1565,,Job,Job,4:6,NCV,You should have confidence because you respect God; you should have hope because you are innocent.,1,Confidence,
1564,,Psalms,Ps,146:3-5,NLT,"Don’t put your confidence in powerful people; there is no help for you there. When they breathe their last…all their plans die with them. But joyful are those who have the God of Israel as their helper, whose hope is in the Lord their God.",2,Confidence,
1563,,Jeremiah,Jer,17:7,NIV,"But blessed is the one who trusts in the Lord, whose confidence is in him.",1,Confidence,
1562,,I Corinthians,I Cor,10:12,MSG,Don't be so naive and self-confident. You're not exempt. You could fall flat on your face as easily as anyone else. Forget about self-confidence; it's useless. Cultivate God-confidence.,2,Confidence,
1561,,Isaiah,Isa,32:16-17,NLT,"Justice will rule in the wilderness and righteousness in the fertile field. And this righteousness will bring peace. Yes, it will bring quietness and confidence forever.",2,Confidence,
1560,,Isaiah,Isa,30:15,NLT,Only in returning to me and resting in me will you be saved.  In quietness and confidence is your strength.,1,Confidence,
1559,Paul,II Corinthians,II Cor,1:10,NLT,"And he did rescue us from mortal danger, and he will rescue us again. We have placed our confidence in him, and he will continue to rescue us.",1,Confidence,
1558,Paul,II Corinthians,II Cor,3:4-6,MSG,"We couldn't be more sure of ourselves in this—that you, written by Christ himself for God, are our letter of recommendation....His letter authorizes us to help carry out this new plan of action. The plan wasn't written out with ink on paper...It's written with Spirit on spirit, his life on our lives!",1,Confidence,
